question,course,document
What does the error message mean when the Parquet column 'DOlocationID' type INT64 doesn't match DOUBLE?,data-engineering-zoomcamp,9ba7b46f
How can I resolve the BigQuery error when exporting an ML model to GCS?,data-engineering-zoomcamp,9ba7b46f
Why might there be a location mismatch error when exporting a ML model?,data-engineering-zoomcamp,9ba7b46f
What steps should I take when facing issues exporting a ML model to GCS?,data-engineering-zoomcamp,9ba7b46f
What might cause a dataset to not be found in the US location in BigQuery operations?,data-engineering-zoomcamp,9ba7b46f
What should I do to fix the error related to 'DOlocationID' column type mismatch?,data-engineering-zoomcamp,b3dd1ec9
How can I resolve the problem of a missing dim_zones.sql dataset in the US location?,data-engineering-zoomcamp,b3dd1ec9
What is the recommended way to specify the location when creating the dim_zones table?,data-engineering-zoomcamp,b3dd1ec9
How do I update the location setting to ensure dim_zones runs successfully?,data-engineering-zoomcamp,b3dd1ec9
What are the steps to follow after fixing the location in the dim_zones table creation?,data-engineering-zoomcamp,b3dd1ec9
What solution is recommended for exporting an ML model if I'm using a MacBook with an Apple M1 chip?,data-engineering-zoomcamp,fdac35ed
How should I set up the serving_dir on my computer according to the instructions?,data-engineering-zoomcamp,fdac35ed
What specific Docker image should I pull for TensorFlow serving on an Apple M1 device?,data-engineering-zoomcamp,fdac35ed
What command should I use to run the Docker container for TensorFlow serving with arm architecture?,data-engineering-zoomcamp,fdac35ed
How can I ensure the curl command provides a prediction after setting up TensorFlow serving?,data-engineering-zoomcamp,fdac35ed
What should I do if I see an error related to column type mismatch in Parquet files?,data-engineering-zoomcamp,d5ed1e8d
How can I address a situation where my virtual machine runs out of storage space?,data-engineering-zoomcamp,d5ed1e8d
What steps can be taken if deleting local data from my VM does not free up enough space?,data-engineering-zoomcamp,d5ed1e8d
How do I handle Prefect-related files when trying to free up space on my VM?,data-engineering-zoomcamp,d5ed1e8d
What tool can help me identify large files on my VM to solve space issues?,data-engineering-zoomcamp,d5ed1e8d
What should I do if I encounter the error regarding Parquet column type mismatch with 'DOlocationID'?,data-engineering-zoomcamp,865d5fae
What does 'Stop with loading the files into a bucket' mean in the context of the homework?,data-engineering-zoomcamp,865d5fae
Why is the Parquet column 'DOlocationID' type mismatch occurring in the external table?,data-engineering-zoomcamp,865d5fae
What are the instructions for creating an external table based on the files loaded into the bucket?,data-engineering-zoomcamp,865d5fae
Is it necessary to clean the data and convert it into Parquet format for the homework task?,data-engineering-zoomcamp,865d5fae
What can I do if reading parquets from nyc.gov into pandas gives an 'Out of bounds' error?,data-engineering-zoomcamp,ae184506
What causes the error when trying to read NYC parquet files directly into pandas?,data-engineering-zoomcamp,ae184506
How can I fix the Parquet error with PyArrow for datetime columns?,data-engineering-zoomcamp,ae184506
Why does pandas have trouble with timestamps when reading from NYC parquet data?,data-engineering-zoomcamp,ae184506
How can I filter out problematic rows when dealing with timestamp errors in parquet files?,data-engineering-zoomcamp,ae184506
What should I do if I encounter an error related to Parquet column types when reading an external table?,data-engineering-zoomcamp,28763435
Are the 2022 NYC taxi data files for the green taxi service available in a single file or multiple files?,data-engineering-zoomcamp,28763435
How can I effectively reference all 12 monthly NYC taxi data files at once in BigQuery?,data-engineering-zoomcamp,28763435
"To complete homework 3, do I need to obtain the NYC taxi data files for each month of 2022 individually?",data-engineering-zoomcamp,28763435
Can I use a wildcard to refer to the 2022 green taxi data files in my GCS bucket for BigQuery integration?,data-engineering-zoomcamp,28763435
What could cause an error with parquet columns during table reading in our course?,data-engineering-zoomcamp,6cf29ed6
How can I prevent schema problems when submitting homework with file uploads?,data-engineering-zoomcamp,6cf29ed6
What is one method to upload multiple files to GCS at once?,data-engineering-zoomcamp,6cf29ed6
Is it possible to upload an entire folder at one time to GCS for our homework?,data-engineering-zoomcamp,6cf29ed6
What should I do to avoid mismatch issues with types like INT64 and DOUBLE in our coursework?,data-engineering-zoomcamp,6cf29ed6
Why isn't my table prediction as expected in Homework Question 5?,data-engineering-zoomcamp,37967607
What should I check if my partitioned table prediction is off?,data-engineering-zoomcamp,37967607
What could cause a table reading error due to type mismatch?,data-engineering-zoomcamp,37967607
How can a Parquet column type mismatch affect my table?,data-engineering-zoomcamp,37967607
What should I consider regarding date formats in partitioned tables?,data-engineering-zoomcamp,37967607
What should I do if I encounter an error reading the table: trips_data_all.external_fhv_tripdata?,data-engineering-zoomcamp,dfbf0b04
Why is there a Parquet column type mismatch error when processing DOlocationID?,data-engineering-zoomcamp,dfbf0b04
Did anyone get an exact match for Module 3 homework question 6?,data-engineering-zoomcamp,dfbf0b04
Is it acceptable to choose a close match for the options in Module 3 question 6?,data-engineering-zoomcamp,dfbf0b04
"How should I proceed if my result for Module 3, Q6, is not an exact match?",data-engineering-zoomcamp,dfbf0b04
What should I do if I encounter a Python UnicodeDecodeError involving an invalid start byte?,data-engineering-zoomcamp,61a89e7d
How can I resolve a Parquet column type mismatch in my error regarding DOlocationID?,data-engineering-zoomcamp,61a89e7d
What encoding should I use when reading data with pandas from the web to avoid a UnicodeDecodeError?,data-engineering-zoomcamp,61a89e7d
Which encoding and compression should be applied when writing a dataframe to GCS as a CSV?,data-engineering-zoomcamp,61a89e7d
Is there an alternative method to read data that avoids the UnicodeDecodeError with pd.read_csv?,data-engineering-zoomcamp,61a89e7d
What is a generator in Python and how does it differ from a list or tuple?,data-engineering-zoomcamp,ab3a7e8e
Can you explain what makes generators memory-efficient in Python?,data-engineering-zoomcamp,ab3a7e8e
What keyword is used to create a generator function in Python?,data-engineering-zoomcamp,ab3a7e8e
How does a generator in Python return an iterator?,data-engineering-zoomcamp,ab3a7e8e
In what scenarios would using a generator be more beneficial than using a list?,data-engineering-zoomcamp,ab3a7e8e
How can I address the error in reading the Parquet column with mismatched types?,data-engineering-zoomcamp,e69b0d1d
What error occurs when the Parquet column type INT64 doesn't match the target cpp_type DOUBLE?,data-engineering-zoomcamp,e69b0d1d
How can I read multiple Parquet files simultaneously in Python?,data-engineering-zoomcamp,e69b0d1d
What function should I use to merge a list of Parquet files into one table in Python?,data-engineering-zoomcamp,e69b0d1d
Which Python function supports merging multiple files into a single output?,data-engineering-zoomcamp,e69b0d1d
How can I correctly convert the DOlocationID column to Int64 in Python?,data-engineering-zoomcamp,33a38233
What is the correct way to change the DOlocationID type to Int64 without errors?,data-engineering-zoomcamp,33a38233
What should I do to avoid a type mismatch error when using the DOlocationID column?,data-engineering-zoomcamp,33a38233
Why does using the method 'astype(int)' on DOlocationID cause an error in this context?,data-engineering-zoomcamp,33a38233
What is the correct syntax to ensure DOlocationID converts to Int64 in pandas?,data-engineering-zoomcamp,33a38233
What should I do if I encounter a data type mismatch when reading a Parquet file?,data-engineering-zoomcamp,b4e8d42c
How can I resolve a ValueError related to a non-existent Prefect storage path?,data-engineering-zoomcamp,b4e8d42c
What causes the error when running a Prefect flow to load data to GCS?,data-engineering-zoomcamp,b4e8d42c
Why might I experience an issue due to the cache_key_fn argument in Prefect?,data-engineering-zoomcamp,b4e8d42c
When is it beneficial to use cache_key_fn in Prefect tasks?,data-engineering-zoomcamp,b4e8d42c
What is a sample snippet for downloading a csv.gz file from a URL using Prefect in an analytics engineering context?,data-engineering-zoomcamp,88321019
How can I automate downloading a csv.gz file from a URL within a Prefect environment?,data-engineering-zoomcamp,88321019
What code can I use with Prefect to download a csv.gz file from a specified URL?,data-engineering-zoomcamp,88321019
Can you provide a Prefect task example for downloading a compressed csv file from the web?,data-engineering-zoomcamp,88321019
How do I write a Prefect flow to download files from a URL as part of analytics engineering?,data-engineering-zoomcamp,88321019
What should I do if I encounter a 'not found in location us' error when using dbt?,data-engineering-zoomcamp,35a7a21f
How can I resolve a DBT Cloud production error related to a 'prod dataset not available in location EU'?,data-engineering-zoomcamp,35a7a21f
Why might everything work fine in development mode but fail when scheduling jobs in production with dbt?,data-engineering-zoomcamp,35a7a21f
What steps did someone take to manually fix a prod dataset location issue in BigQuery for EU?,data-engineering-zoomcamp,35a7a21f
How can I update seed column types in the dbt_project.yaml file to fix a location error?,data-engineering-zoomcamp,35a7a21f
What should I do if a project lacks a development environment configuration in Module 4?,data-engineering-zoomcamp,972b2eff
How can I resolve the error regarding missing development environment setup in analytics engineering with dbt?,data-engineering-zoomcamp,972b2eff
Where can I find guidance to create and configure a development environment for dbt?,data-engineering-zoomcamp,972b2eff
"If I encounter an error about no development environment, what resources are available to help me?",data-engineering-zoomcamp,972b2eff
"In Module 4, what steps should be followed when dbt prompts for configuring development credentials?",data-engineering-zoomcamp,972b2eff
What should I do if I encounter a runtime error while connecting dbt Cloud to BigQuery?,data-engineering-zoomcamp,da8a5fc6
How can I grant my dbt service account access if it doesn't appear in IAM?,data-engineering-zoomcamp,da8a5fc6
What role should be added to my service account to fix BigQuery access issues?,data-engineering-zoomcamp,da8a5fc6
What additional roles might prevent permission issues during the course?,data-engineering-zoomcamp,da8a5fc6
Where can I find more information about configuring my dbt profile?,data-engineering-zoomcamp,da8a5fc6
What could cause a dbt Cloud build to be cancelled?,data-engineering-zoomcamp,0ea871d9
How can I resolve the issue of a missing dbt project in dbt Cloud?,data-engineering-zoomcamp,0ea871d9
What should I check if my dbt Cloud run is failing due to project issues?,data-engineering-zoomcamp,0ea871d9
Where do I specify the location of my dbt project in dbt Cloud settings?,data-engineering-zoomcamp,0ea871d9
What file needs to be in the repository for a dbt Cloud project to run successfully?,data-engineering-zoomcamp,0ea871d9
What should I do if I face a 'Permission denied (publickey)' error while trying to clone the dbt module repository?,data-engineering-zoomcamp,55c71d65
How can I resolve the issue of failed repository cloning due to lack of permissions for the DataTalksClub/data-engineering-zoomcamp.git?,data-engineering-zoomcamp,55c71d65
Is there an alternative way to clone the data-engineering-zoomcamp repository if the SSH method fails?,data-engineering-zoomcamp,55c71d65
What are the recommended steps for setting up a new repository for dbt lessons in case of permission issues with the original repository?,data-engineering-zoomcamp,55c71d65
"Why might I receive a 'Could not read from remote repository' error when attempting to clone the dbt project repo, and how can it be fixed?",data-engineering-zoomcamp,55c71d65
Why am I unable to create a CI Job in dbt Cloud on the Developer Plan?,data-engineering-zoomcamp,3d0c3cdd
How can I enable the CI Job feature when I have the pull requests option disabled?,data-engineering-zoomcamp,3d0c3cdd
What are the requirements to create a CI Job in dbt Cloud?,data-engineering-zoomcamp,3d0c3cdd
What should I do if the CI Job feature is disabled during the Team Plan trial period?,data-engineering-zoomcamp,3d0c3cdd
How can someone on the Developer plan work around the disabled CI Job issue?,data-engineering-zoomcamp,3d0c3cdd
What should I do if the DBT cloud IDE keeps loading without starting?,data-engineering-zoomcamp,0710f0dc
How do I resolve the error message when my IDE session fails to start?,data-engineering-zoomcamp,0710f0dc
What is the solution if the IDE session in DBT cloud cannot launch?,data-engineering-zoomcamp,0710f0dc
Where can I find instructions to fix the endless loading issue with DBT IDE?,data-engineering-zoomcamp,0710f0dc
How can I import a repository into my DBT project if the IDE won't start?,data-engineering-zoomcamp,0710f0dc
What can cause issues with column datatypes when converting from CSV to Parquet in DBT/BigQuery and how can it be resolved?,data-engineering-zoomcamp,d9f0c6a4
How can I modify the script to handle gz files while running the web_to_gcp.py pipeline?,data-engineering-zoomcamp,d9f0c6a4
What is a possible solution to the error regarding 'ehail_fee' column type mismatch in Parquet files during DBT run?,data-engineering-zoomcamp,d9f0c6a4
How can I fix datatype mismatches in parquet files using Pandas while importing from CSV to a DataFrame?,data-engineering-zoomcamp,d9f0c6a4
Which Pandas parameter can be used to handle nullable integer data types when importing CSV files to DataFrame?,data-engineering-zoomcamp,d9f0c6a4
What should I do if I receive an Access Denied error when using the quick script to load trip data into GCS?,data-engineering-zoomcamp,5350dc4d
Is there an alternative way to obtain trip data if the provided S3 URL isn't working for me?,data-engineering-zoomcamp,5350dc4d
How can I download trip data using the GitHub CLI when facing issues with the S3 bucket?,data-engineering-zoomcamp,5350dc4d
What are the commands to download the yellow and green trip data releases using GitHub CLI?,data-engineering-zoomcamp,5350dc4d
What is the procedure to upload trip data files to a GCS bucket after downloading them manually?,data-engineering-zoomcamp,5350dc4d
What error occurs with the format_to_parquet_task during fhv_tripdata_2020-01.csv conversion?,data-engineering-zoomcamp,20073c7c
What causes the pyarrow.lib.ArrowInvalid error in module 4?,data-engineering-zoomcamp,20073c7c
How can I fix random line breaks in fhv_tripdata_2020-01.csv?,data-engineering-zoomcamp,20073c7c
Which command deletes incorrect line breaks in fhv_tripdata_2020-01.csv?,data-engineering-zoomcamp,20073c7c
What should I do after fixing the CSV parse error to re-run the task in Airflow?,data-engineering-zoomcamp,20073c7c
What is a hack for loading yellow and green trip data for 2019 and 2020?,data-engineering-zoomcamp,0d4bd8d9
What problems did you initially encounter when loading the yellow trip data into Google Cloud Storage?,data-engineering-zoomcamp,0d4bd8d9
What issue arose when uploading the parquet files directly to Google Cloud Storage before creating the BigQuery table?,data-engineering-zoomcamp,0d4bd8d9
"Who shared an alternative hack on Slack for loading the yellow and green trip data, and where else can I watch it?",data-engineering-zoomcamp,0d4bd8d9
Why is it important to watch the entire video for loading data into BigQuery mentioned in the record?,data-engineering-zoomcamp,0d4bd8d9
How can I transfer multiple files from Google Cloud Storage to BigQuery?,data-engineering-zoomcamp,39fdb034
What is the method to move several files from a cloud storage bucket to BigQuery?,data-engineering-zoomcamp,39fdb034
Which file path should I use to transfer numerous files from storage to BigQuery?,data-engineering-zoomcamp,39fdb034
What is required to move many files from Google Cloud Storage to BigQuery?,data-engineering-zoomcamp,39fdb034
What file pattern is needed to migrate multiple files from a cloud bucket to BigQuery?,data-engineering-zoomcamp,39fdb034
Why can't I connect via SSH to my GCP VM after a recent reboot?,data-engineering-zoomcamp,b45b9a5f
What should I do if SSH access to my GCP VM fails unexpectedly?,data-engineering-zoomcamp,b45b9a5f
Could low storage space stop SSH from working on my GCP VM?,data-engineering-zoomcamp,b45b9a5f
How can running prefect cause issues with SSH access to my VM?,data-engineering-zoomcamp,b45b9a5f
What maintenance task should be performed regularly to prevent SSH issues on my VM?,data-engineering-zoomcamp,b45b9a5f
What can I do if SSH access to my GCP VM is lost?,data-engineering-zoomcamp,28734eb1
How to resolve permission denied (publickey) error on GCP VM?,data-engineering-zoomcamp,28734eb1
What steps should I take if my GCP VM runs out of space?,data-engineering-zoomcamp,28734eb1
What should I do if I can't SSH into my machine on GCP?,data-engineering-zoomcamp,28734eb1
How can SSH access issues be fixed on a GCP VM?,data-engineering-zoomcamp,28734eb1
What should I do if my BigQuery dataset is not found in the specified location?,data-engineering-zoomcamp,600769a5
How can I check the location of my source dataset and schema in BigQuery?,data-engineering-zoomcamp,600769a5
What steps should I take if my source data and write location are in different regions?,data-engineering-zoomcamp,600769a5
How do I specify a single-region location in my DBT project?,data-engineering-zoomcamp,600769a5
What are the steps to update the location in DBT Cloud using the profile page?,data-engineering-zoomcamp,600769a5
What change should be made if a dbt run generates a warning due to dbt_utils.surrogate_key?,data-engineering-zoomcamp,79807d86
What is the solution if dbt run fails with an access denied error after creating fact_trips.sql?,data-engineering-zoomcamp,79807d86
What role needs to be added to a service account in BigQuery to fix permission issues?,data-engineering-zoomcamp,79807d86
What should replace dbt_utils.surrogate_key in the stg_green_tripdata.sql file?,data-engineering-zoomcamp,79807d86
What roles should be added to the service account in GCS when access is denied?,data-engineering-zoomcamp,79807d86
What should you do if the dbt_utils package is missing?,data-engineering-zoomcamp,8ad3bf90
How can you resolve an error stating dbt_utils is not found?,data-engineering-zoomcamp,8ad3bf90
Which file do you need to create if you encounter a dbt_utils error?,data-engineering-zoomcamp,8ad3bf90
What metadata should be added to resolve the dbt_utils error?,data-engineering-zoomcamp,8ad3bf90
What command should be run after editing packages.yml for dbt_utils?,data-engineering-zoomcamp,8ad3bf90
What should I do if my lineage is unavailable in dbt?,data-engineering-zoomcamp,d5cd381e
How can I make sure that my yml file is formatted correctly to avoid lineage issues?,data-engineering-zoomcamp,d5cd381e
"If lineage is unavailable, where can I find the build logs for a successful run?",data-engineering-zoomcamp,d5cd381e
Where do I go to read error messages or warnings when lineage is unavailable?,data-engineering-zoomcamp,d5cd381e
How can I access the command history console to check the build process?,data-engineering-zoomcamp,d5cd381e
Why might my Fact_trips dataset show limited date coverage in Module 4?,data-engineering-zoomcamp,b5d43d79
How can I ensure my dbt run uses the correct date range for Fact_trips?,data-engineering-zoomcamp,b5d43d79
What command should I use to avoid limited data in Fact_trips?,data-engineering-zoomcamp,b5d43d79
How do I fix Fact_trips missing data from several days?,data-engineering-zoomcamp,b5d43d79
What changes should I make if Fact_trips contains only a few days of data?,data-engineering-zoomcamp,b5d43d79
Why might my fact_trips table in BigQuery have data for only one month?,data-engineering-zoomcamp,ec15bb03
What should be checked if the fact_trips table only contains one month of data?,data-engineering-zoomcamp,ec15bb03
How does using if_exists='replace' affect the data in fact_trips when writing to BigQuery?,data-engineering-zoomcamp,ec15bb03
What is the difference between using if_exists='replace' and if_exists='append' in BigQuery?,data-engineering-zoomcamp,ec15bb03
How can I ensure my BigQuery table includes data for all months I want from GCS?,data-engineering-zoomcamp,ec15bb03
Could you explain how to fix the error with the dm_monthly_zone_revenue.sql model in BigQuery?,data-engineering-zoomcamp,07082ab7
What change should be made to the SELECT statement in dm_monthly_zone_revenue.sql to resolve an error?,data-engineering-zoomcamp,07082ab7
How can I correct the issue in the dm_monthly_zone_revenue.sql model related to month truncation?,data-engineering-zoomcamp,07082ab7
What's the proper way to modify date_trunc function in the dm_monthly_zone_revenue.sql for BigQuery?,data-engineering-zoomcamp,07082ab7
"In BigQuery, how do I modify the dm_monthly_zone_revenue.sql model to correctly execute?",data-engineering-zoomcamp,07082ab7
What should replace the dbt_utils.surrogate_key to generate keys in Module 4?,data-engineering-zoomcamp,b8d339a7
"In the context of analytics engineering with dbt, how do you replace the legacy surrogate key function?",data-engineering-zoomcamp,b8d339a7
What is the updated method for creating surrogate keys instead of using dbt_utils.surrogate_key?,data-engineering-zoomcamp,b8d339a7
"During Module 4, which function is suggested for surrogate key generation over dbt_utils.surrogate_key?",data-engineering-zoomcamp,b8d339a7
What code substitution is advised for generating surrogate keys in the dbt module?,data-engineering-zoomcamp,b8d339a7
What steps should I take if I get an error after changing the dbt location?,data-engineering-zoomcamp,b4995172
How can I resolve the dbt run error related to a changed location?,data-engineering-zoomcamp,b4995172
What should I do if dbt run fails due to incorrect location settings?,data-engineering-zoomcamp,b4995172
How do I fix location errors in dbt when using BigQuery?,data-engineering-zoomcamp,b4995172
What is the solution to dbt run errors after updating the location?,data-engineering-zoomcamp,b4995172
Why does my table in BigQuery still have 100 rows after specifying a variable in dbt run?,data-engineering-zoomcamp,2f02f110
What should I do to ensure my BigQuery dataset has all the rows when using dbt?,data-engineering-zoomcamp,2f02f110
Why am I seeing a new dbt dataset in BigQuery after running my CI/CD job?,data-engineering-zoomcamp,2f02f110
How can I prevent dbt from creating a new environment in BigQuery during CI/CD runs?,data-engineering-zoomcamp,2f02f110
What setting should I adjust in my CI/CD job to merge dev models into production models in dbt?,data-engineering-zoomcamp,2f02f110
What is the purpose of the intermediate datasets between raw and final tables in analytics engineering with dbt?,data-engineering-zoomcamp,971fb910
Why are some datasets materialized as views rather than tables in the context of analytics engineering?,data-engineering-zoomcamp,971fb910
"In the dbt tutorial, why didn't Vic create a staging dataset for the project demo?",data-engineering-zoomcamp,971fb910
How many different datasets did Vic create in the videos related to analytics engineering?,data-engineering-zoomcamp,971fb910
What datasets should I focus on creating for the production environment according to the dbt module instructions?,data-engineering-zoomcamp,971fb910
What should I do if I can't access DBT docs in my browser?,data-engineering-zoomcamp,d7e82df1
How can I solve the issue of DBT docs not opening despite being served?,data-engineering-zoomcamp,d7e82df1
What is a solution to access DBT docs if the network host line is present?,data-engineering-zoomcamp,d7e82df1
How do I fix the problem of DBT docs being served but not visible in the browser?,data-engineering-zoomcamp,d7e82df1
What step should be taken if DBT documentation is not accessible on a browser?,data-engineering-zoomcamp,d7e82df1
What should I do if I encounter a 404 Not Found error stating that the dataset was not found in location europe-west6 while using the BigQuery adapter?,data-engineering-zoomcamp,f5729176
How can I resolve an error related to a missing dataset location when working with dbt and BigQuery?,data-engineering-zoomcamp,f5729176
"If my dataset isn't found in the specified location europe-west6, what is the procedure to fix this issue in dbt?",data-engineering-zoomcamp,f5729176
What steps are necessary to address a location error for a dataset in BigQuery within dbt's analytics engineering module?,data-engineering-zoomcamp,f5729176
How do I change the dataset location setting in BigQuery to the correct GCP location when facing a 404 error in dbt?,data-engineering-zoomcamp,f5729176
How can I make changes if the main branch is 'read-only'?,data-engineering-zoomcamp,a69dd46a
What should I do to edit the dbt project if the main branch cannot be modified?,data-engineering-zoomcamp,a69dd46a
"If the main branch is not editable, what steps should I take?",data-engineering-zoomcamp,a69dd46a
