question,course,document
How many hours should I dedicate to each module weekly?,machine-learning-zoomcamp,cf037b16
Does Timur Kamaliev provide insights into the time investment required?,machine-learning-zoomcamp,cf037b16
Where can I find the detailed time analysis for the course?,machine-learning-zoomcamp,cf037b16
What are the requirements to receive a certificate?,machine-learning-zoomcamp,7d8dbaad
How many projects and peer reviews are needed to earn a certificate?,machine-learning-zoomcamp,7d8dbaad
Will I get a certificate if I complete one project and review three peers?,machine-learning-zoomcamp,7d8dbaad
Is there a deadline for project completion and peer reviews for certification?,machine-learning-zoomcamp,7d8dbaad
Are there different versions of the certificate available?,machine-learning-zoomcamp,7d8dbaad
Is obtaining a certificate feasible if I did not submit the midterm project?,machine-learning-zoomcamp,5cf61357
Can I still receive a certificate despite missing the midterm project?,machine-learning-zoomcamp,5cf61357
Am I eligible for a certificate if the midterm project was not completed?,machine-learning-zoomcamp,5cf61357
Will missing the midterm project impact my ability to get a certificate?,machine-learning-zoomcamp,5cf61357
Does the certificate criterion allow missing the midterm project?,machine-learning-zoomcamp,5cf61357
What prior Python knowledge is required to join the course?,machine-learning-zoomcamp,0843677a
Where can I find a resource to evaluate my Python proficiency?,machine-learning-zoomcamp,0843677a
What online platform offers a free course on Python basics?,machine-learning-zoomcamp,0843677a
Which Python fundamentals are crucial for this course?,machine-learning-zoomcamp,0843677a
What operations and concepts should I understand for data analysis in Python?,machine-learning-zoomcamp,0843677a
What type of laptop specifications are required for the Machine Learning portion of the course?,machine-learning-zoomcamp,438b4299
Is it necessary to have advanced hardware for the Deep Learning sections?,machine-learning-zoomcamp,438b4299
Does the course recommend a specific cloud service for running Deep Learning tasks?,machine-learning-zoomcamp,438b4299
Can the entire course be completed without using any cloud services?,machine-learning-zoomcamp,438b4299
Who provided the information on hardware and cloud requirements in the course?,machine-learning-zoomcamp,438b4299
Where can I find instructions for installing TensorFlow with GPU on Ubuntu?,machine-learning-zoomcamp,244fa0b1
Is there an online resource to assist with using TensorFlow's GPU setup on my system?,machine-learning-zoomcamp,244fa0b1
Can you recommend any guides for setting up TensorFlow with GPU capabilities on an Ubuntu machine?,machine-learning-zoomcamp,244fa0b1
What is a reliable source for configuring TensorFlow to work with a GPU in Ubuntu?,machine-learning-zoomcamp,244fa0b1
How do I get TensorFlow GPU support operational on my Ubuntu computer?,machine-learning-zoomcamp,244fa0b1
I'm having trouble navigating Slack. How can I locate our course channel on it?,machine-learning-zoomcamp,ac55c786
Is it mandatory to share the GitHub repository link containing code for homework questions?,machine-learning-zoomcamp,ac55c786
Could you guide me on how to access and join a specific channel in Slack?,machine-learning-zoomcamp,ac55c786
Do we need to submit a GitHub link for getting grades on homework assignments?,machine-learning-zoomcamp,ac55c786
Can you explain the process of finding and joining channels in Slack?,machine-learning-zoomcamp,ac55c786
Is it possible to join the course after it has started?,machine-learning-zoomcamp,35278856
What is the requirement for receiving a course certificate?,machine-learning-zoomcamp,35278856
Can I participate in the course if I haven't submitted all the homeworks?,machine-learning-zoomcamp,35278856
"If I join at the end of November, can I still earn a certificate?",machine-learning-zoomcamp,35278856
How many peers' projects do I need to review to get a certificate?,machine-learning-zoomcamp,35278856
Is the course content accessible at any time?,machine-learning-zoomcamp,2fd045f4
When can I join the course with a group?,machine-learning-zoomcamp,2fd045f4
Are there multiple starting options for this course?,machine-learning-zoomcamp,2fd045f4
"If I want to learn with others, when should I enroll?",machine-learning-zoomcamp,2fd045f4
Is there a self-paced option available for this course?,machine-learning-zoomcamp,2fd045f4
Is it an option to turn in assignments once the deadline has passed?,machine-learning-zoomcamp,973f438a
What happens if I miss a homework deadline?,machine-learning-zoomcamp,973f438a
Am I allowed to submit late homework?,machine-learning-zoomcamp,973f438a
Can homework be submitted after it is due?,machine-learning-zoomcamp,973f438a
Is the form for homework submissions still open after the due date?,machine-learning-zoomcamp,973f438a
How do I find and view previous cohort office hour recordings?,machine-learning-zoomcamp,5aa6218d
Where can I find the link to start accessing the course syllabus online?,machine-learning-zoomcamp,5aa6218d
Where should I go to access all the course materials after joining?,machine-learning-zoomcamp,5aa6218d
What is the first step I should take immediately after joining the course?,machine-learning-zoomcamp,5aa6218d
How can I locate the course videos organized by year on YouTube?,machine-learning-zoomcamp,5aa6218d
Where can I find the deadlines for my cohort?,machine-learning-zoomcamp,01f528ce
Are there specific deadline details available for the 2023 cohort?,machine-learning-zoomcamp,01f528ce
Where should I look to view the 2023 course deadlines?,machine-learning-zoomcamp,01f528ce
Is there a page that lists all the course deadlines for this year's students?,machine-learning-zoomcamp,01f528ce
How can I access the deadline schedule for the current year?,machine-learning-zoomcamp,01f528ce
What distinguishes this year's course iteration from last year's?,machine-learning-zoomcamp,ca9dbb6e
Is there a unique module in the 2023 iteration compared to 2022?,machine-learning-zoomcamp,ca9dbb6e
How has the homework changed from the 2022 course iteration to 2023?,machine-learning-zoomcamp,ca9dbb6e
Does the 2023 course include the BentoML module like in 2022?,machine-learning-zoomcamp,ca9dbb6e
Are the modules in the 2023 course the same as those in 2022?,machine-learning-zoomcamp,ca9dbb6e
Will new course videos be released or will we use the existing ones from 2021?,machine-learning-zoomcamp,1d97c3fb
Has the focus of the course changed since the last iteration?,machine-learning-zoomcamp,1d97c3fb
Can I still start watching the course videos if I missed the previous iteration?,machine-learning-zoomcamp,1d97c3fb
Is there an updated version of Python recommended for the course now?,machine-learning-zoomcamp,1d97c3fb
Are the current videos still considered up-to-date for learning the skills taught in the course?,machine-learning-zoomcamp,1d97c3fb
How can I earn extra credit by sharing my learning progress on social media for this course?,machine-learning-zoomcamp,fc26db97
Is there a limit to how many learning in public links I can submit for extra credit?,machine-learning-zoomcamp,fc26db97
Will posting the same content on different platforms earn extra credits?,machine-learning-zoomcamp,fc26db97
How do points for sharing my progress differ between regular assignments and projects?,machine-learning-zoomcamp,fc26db97
Where do I include the URLs of my learning in public posts when submitting my homework?,machine-learning-zoomcamp,fc26db97
How do I add my notes to the community notes section?,machine-learning-zoomcamp,e3c2e984
What is the process for creating my own course repository?,machine-learning-zoomcamp,e3c2e984
Where should I add the link to my notes in the course repository?,machine-learning-zoomcamp,e3c2e984
What is the final step to sync my fork with the original course repository?,machine-learning-zoomcamp,e3c2e984
Who provided the instructions for adding community notes?,machine-learning-zoomcamp,e3c2e984
How can I compute the hash for my email to check my scores on the leaderboard?,machine-learning-zoomcamp,9c917409
Where can I find the leaderboard links for 2023 and 2022 to see my position?,machine-learning-zoomcamp,9c917409
What Python library and function should I use to hash my email for the leaderboard?,machine-learning-zoomcamp,9c917409
Is there an online tool available to hash my email if I don't want to use Python?,machine-learning-zoomcamp,9c917409
Who provided the instructions for using Python and the online tool for email hashing?,machine-learning-zoomcamp,9c917409
How can I resolve wget is not recognized as a command error on Windows?,machine-learning-zoomcamp,58cc7cc1
What steps should I follow to install wget on a Mac?,machine-learning-zoomcamp,58cc7cc1
Is there a way to use wget functionality in Python without installing wget?,machine-learning-zoomcamp,58cc7cc1
Can urllib.request be used to download files on any platform or device?,machine-learning-zoomcamp,58cc7cc1
How do you read a CSV file directly from a URL using pandas?,machine-learning-zoomcamp,58cc7cc1
How can I download a CSV file into my notebook using shell commands?,machine-learning-zoomcamp,4219a488
What is the purpose of the exclamation mark in notebook commands?,machine-learning-zoomcamp,4219a488
Can you give an example of moving a file to a different directory using shell commands in a notebook?,machine-learning-zoomcamp,4219a488
Which shell commands can be executed directly from a notebook?,machine-learning-zoomcamp,4219a488
How can I organize downloaded data files into a specific directory within my project?,machine-learning-zoomcamp,4219a488
How can I access Linux on a Windows 11 device?,machine-learning-zoomcamp,17cbba42
Which VS Code extension do I need to connect to WSL Ubuntu?,machine-learning-zoomcamp,17cbba42
Where can I find the instructions to set up a WSL development environment?,machine-learning-zoomcamp,17cbba42
Can I use Windows WSL to access Linux like a virtual machine?,machine-learning-zoomcamp,17cbba42
Who provided the answer for setting up a WSL and VS Code connection?,machine-learning-zoomcamp,17cbba42
How can I resolve the error message 'src refspec master does not match any' when pushing my homework to GitHub?,machine-learning-zoomcamp,da579513
What should I do if I receive an error while trying to push code to the GitHub repository for the first time?,machine-learning-zoomcamp,da579513
Is there a beginner-friendly tutorial I can follow to learn how to use GitHub for submitting homework assignments?,machine-learning-zoomcamp,da579513
Can I upload my homework code directly from Google Colab to my GitHub account?,machine-learning-zoomcamp,da579513
Is there an alternative way to upload my homework files to GitHub besides using the command line?,machine-learning-zoomcamp,da579513
What causes the singular matrix error when trying to invert a matrix in my homework?,machine-learning-zoomcamp,95ba2b4d
Why might I receive a singular matrix error related to matrix multiplication?,machine-learning-zoomcamp,95ba2b4d
How does the order of matrix multiplication relate to the occurrence of a singular matrix error?,machine-learning-zoomcamp,95ba2b4d
What should I pay attention to when using the .dot method to avoid a singular matrix error?,machine-learning-zoomcamp,95ba2b4d
Why is it important to respect the order in matrix multiplication during our homework?,machine-learning-zoomcamp,95ba2b4d
What should I do if the terminal does not recognize the command 'conda create -n ml-zoomcamp python=3.9'?,machine-learning-zoomcamp,40f6d5dc
Which versions of Python are acceptable for the command to create a virtual environment in this course?,machine-learning-zoomcamp,40f6d5dc
What might be the solution if 'conda' is not recognized in the terminal on Windows after installing Anaconda?,machine-learning-zoomcamp,40f6d5dc
What terminal should I use if Anaconda commands don't work in the regular one on Windows?,machine-learning-zoomcamp,40f6d5dc
What steps should I take if I encounter issues with 'conda' not being recognized and I don't have necessary software installed?,machine-learning-zoomcamp,40f6d5dc
How can I correctly load a dataset with Pandas in Windows using the proper file path syntax?,machine-learning-zoomcamp,73e8354f
What should I do to resolve file path conflicts when using Pandas read_csv on Windows?,machine-learning-zoomcamp,73e8354f
Why does the backslash in my file path for Pandas cause issues on Windows?,machine-learning-zoomcamp,73e8354f
What is the purpose of adding 'r' before the file path in Pandas for Windows?,machine-learning-zoomcamp,73e8354f
How do escape sequences affect file paths in Python on Windows when using Pandas?,machine-learning-zoomcamp,73e8354f
How can I resolve a '403 Forbidden' error when pushing to my GitHub repository?,machine-learning-zoomcamp,a233dacd
What is a typical cause for receiving a '403 Forbidden' error during a Git push operation?,machine-learning-zoomcamp,a233dacd
Which Git command can help me identify the remote URL that might be causing access issues?,machine-learning-zoomcamp,a233dacd
What format should the Git remote URL follow to fix a '403 Forbidden' error?,machine-learning-zoomcamp,a233dacd
Who provided the solution to the '403 Forbidden' error issue detailed in the Introduction to Machine Learning section?,machine-learning-zoomcamp,a233dacd
What should I do if I see 'Fatal: Authentication failed for' when pushing code to GitHub?,machine-learning-zoomcamp,dd855a4a
What is the solution when Git Bash says remote: Support for password authentication was removed?,machine-learning-zoomcamp,dd855a4a
How can I push my code if the authentication fails due to password removal for GitHub?,machine-learning-zoomcamp,dd855a4a
Where can I find information on cloning GitHub repositories with HTTPS URLs?,machine-learning-zoomcamp,dd855a4a
How do I create a personal access token to resolve GitHub authentication issues?,machine-learning-zoomcamp,dd855a4a
How can I resolve the wget error when accessing a GitHub dataset on Kaggle?,machine-learning-zoomcamp,6e0a11cc
Why does wget fail to resolve the host address for GitHub in Kaggle?,machine-learning-zoomcamp,6e0a11cc
What is the solution for temporary failure in name resolution in Kaggle?,machine-learning-zoomcamp,6e0a11cc
How do I enable Internet for my session in a Kaggle notebook?,machine-learning-zoomcamp,6e0a11cc
Why do I need to verify my phone number in Kaggle settings?,machine-learning-zoomcamp,6e0a11cc
How can I set up a Python virtual environment using VS Code?,machine-learning-zoomcamp,c9c5a79c
Is it possible to run Jupyter Notebooks directly in VS Code without a browser?,machine-learning-zoomcamp,c9c5a79c
What steps are necessary to execute Jupyter Notebooks on a remote server through VS Code?,machine-learning-zoomcamp,c9c5a79c
How can I use Git features like staging and commits within VS Code?,machine-learning-zoomcamp,c9c5a79c
Where can I find a video tutorial on configuring a remote connection in VS Code?,machine-learning-zoomcamp,c9c5a79c
Is it necessary to run 'conda create -n ....' each time I start a new work session in VS Code for the project?,machine-learning-zoomcamp,f1633aca
"After creating the environment with 'conda create -n ....', what command should I run whenever I want to use it?",machine-learning-zoomcamp,f1633aca
Can I reproduce my existing Conda environment in a file format?,machine-learning-zoomcamp,f1633aca
What command is used to save an existing Conda environment into a YAML file?,machine-learning-zoomcamp,f1633aca
How can I recreate a Conda environment using the environment.yml file?,machine-learning-zoomcamp,f1633aca
Why does multiplying the inverse of XTX by the original matrix not produce an exact identity matrix in Question 7 of Week 1 Homework?,machine-learning-zoomcamp,4a7b8a78
"What happens when I multiply the inverse of XTX by the original matrix, and why does it not return an exact identity matrix?",machine-learning-zoomcamp,4a7b8a78
"Why does floating point precision affect the results of matrix multiplication in Week 1 Homework Question 7, Step 6?",machine-learning-zoomcamp,4a7b8a78
Could you explain why floating point math doesn't result in precise identity matrices when multiplying inverses with original matrices?,machine-learning-zoomcamp,4a7b8a78
Why didn't I get an identity matrix when I multiplied the inverse with the original matrix in Step 6 of Question 7 from Week 1 Homework?,machine-learning-zoomcamp,4a7b8a78
What function do you use to print dataset details in pandas?,machine-learning-zoomcamp,3427e122
How can you determine the number of columns and their types in a dataset using pandas?,machine-learning-zoomcamp,3427e122
What command helps you find memory usage details of a pandas dataset?,machine-learning-zoomcamp,3427e122
Which method shows index datatype and not-null count in a DataFrame?,machine-learning-zoomcamp,3427e122
How do you get a summary of entries and their data types in a DataFrame?,machine-learning-zoomcamp,3427e122
What does it mean when I encounter a NameError stating 'name np is not defined'?,machine-learning-zoomcamp,dca76802
Why am I seeing a NameError for 'name pd is not defined' in my code?,machine-learning-zoomcamp,dca76802
What should I include at the beginning of my script when using numpy?,machine-learning-zoomcamp,dca76802
How can I resolve issues with pandas not being recognized in my code?,machine-learning-zoomcamp,dca76802
What are the imports required to avoid NameErrors with numpy and pandas?,machine-learning-zoomcamp,dca76802
questions,machine-learning-zoomcamp,28758fd1
How can you determine the shape of a dataset in Pandas?,machine-learning-zoomcamp,24042709
What attribute helps identify the number of columns in a DataFrame?,machine-learning-zoomcamp,24042709
Which method is used to find out the number of rows in a dataset?,machine-learning-zoomcamp,24042709
How is the shape of a DataFrame accessed?,machine-learning-zoomcamp,24042709
What tool is suggested by Radikal Lukafiardi for dataset shape identification?,machine-learning-zoomcamp,24042709
What is a common mistake to avoid to prevent Value errors related to array shapes in the coursework for Machine Learning?,machine-learning-zoomcamp,0c675084
Can you explain the importance of the order of matrices in performing matrix multiplication?,machine-learning-zoomcamp,0c675084
What should be done if the dimensions do not match when attempting matrix multiplication?,machine-learning-zoomcamp,0c675084
Which function should be used for matrix multiplication to minimize errors during homework?,machine-learning-zoomcamp,0c675084
Who contributed the guidelines on handling matrix dimension mismatch in the introduction to Machine Learning course?,machine-learning-zoomcamp,0c675084
What is the process of replacing NaN values in a dataset with the column average?,machine-learning-zoomcamp,178f9758
Why is it important to replace NaN values with the average of the column?,machine-learning-zoomcamp,178f9758
How do we compute and store the average of a column for replacing NaN values?,machine-learning-zoomcamp,178f9758
What term is used to describe the process of filling NaN values with the column average?,machine-learning-zoomcamp,178f9758
Why might it be undesirable to remove rows with NaN values instead of replacing them with the column average?,machine-learning-zoomcamp,178f9758
What is the mathematical formula used to solve the initial problem in linear regression?,machine-learning-zoomcamp,51fd3fb3
Which resources can I refer to for further reading on linear regression in matrix form?,machine-learning-zoomcamp,51fd3fb3
Who contributed to the explanation of the linear regression formula in this section?,machine-learning-zoomcamp,51fd3fb3
How can linear regression be represented using matrices?,machine-learning-zoomcamp,51fd3fb3
What additional materials are included in Question 7 for better understanding?,machine-learning-zoomcamp,51fd3fb3
Why could the final multiplication end without five columns?,machine-learning-zoomcamp,9300a714
What is a common mistake with the first step of multiplication?,machine-learning-zoomcamp,9300a714
Who provided information about the final multiplication issue?,machine-learning-zoomcamp,9300a714
What is the likely reason for missing columns in multiplication results?,machine-learning-zoomcamp,9300a714
In what instance might you mistakenly use rather than another method in multiplication?,machine-learning-zoomcamp,9300a714
How is matrix multiplication commonly represented in different sources?,machine-learning-zoomcamp,f01f5217
What operator should be used for element-wise multiplication?,machine-learning-zoomcamp,f01f5217
Which operator is recommended for matrix-matrix multiplication according to numpy documentation?,machine-learning-zoomcamp,f01f5217
What is the preferred method for multiplying a matrix by a scalar?,machine-learning-zoomcamp,f01f5217
Are numpy.dot() and ndarray.dot() suitable for matrix multiplication?,machine-learning-zoomcamp,f01f5217
What should I do if I encounter an ImportError related to 'contextfilter' when launching a Jupyter notebook?,machine-learning-zoomcamp,6da62fb7
How can I resolve the 'cannot import name contextfilter from jinja2' error in a new Jupyter notebook environment?,machine-learning-zoomcamp,6da62fb7
What is the solution to the jinja2 ImportError when using Jupyter notebooks?,machine-learning-zoomcamp,6da62fb7
How do I fix the error importing 'contextfilter' from 'jinja2' in a new notebook?,machine-learning-zoomcamp,6da62fb7
Which command should I run to upgrade nbconvert for fixing the ImportError in Jupyter?,machine-learning-zoomcamp,6da62fb7
What should I do if downloading a file using wget stops working on MacOS Ventura with an M1 chip?,machine-learning-zoomcamp,d008f971
How do I address the issue of wget hanging during download on my MacBook with Ventura installed?,machine-learning-zoomcamp,d008f971
"If wget shows IPv6 addresses in the terminal and hangs, what steps should I follow on MacOS?",machine-learning-zoomcamp,d008f971
Where can I find the option to configure IPv6 settings on a Mac to resolve wget download issues?,machine-learning-zoomcamp,d008f971
How do I manually set up IPv6 on MacOS Ventura to fix wget connectivity problems?,machine-learning-zoomcamp,d008f971
What can I use on macOS instead of Wget when downloading files from the internet?,machine-learning-zoomcamp,136a1214
How can I use curl to download a file and save it with a specific name?,machine-learning-zoomcamp,136a1214
What is the function of the -o option in the curl command?,machine-learning-zoomcamp,136a1214
Where can I find more detailed information about how to use curl?,machine-learning-zoomcamp,136a1214
Who contributed the information about using curl as an alternative to Wget on macOS?,machine-learning-zoomcamp,136a1214
How can I limit the number of decimal places when outputting a number in Python?,machine-learning-zoomcamp,ba91d56f
What Python tool can I use to round the value within a pandas Series?,machine-learning-zoomcamp,ba91d56f
Which Python method helps in formatting strings with controlled decimal precision?,machine-learning-zoomcamp,ba91d56f
Is there any resource to learn more about rounding values within pandas Series?,machine-learning-zoomcamp,ba91d56f
Can I use both round() function and f-strings for controlling decimal places in output?,machine-learning-zoomcamp,ba91d56f
"Where can I find the links for Week 2 of the course starting September 18, 2023?",machine-learning-zoomcamp,25c851cc
How do I submit my homework for the second week of the course?,machine-learning-zoomcamp,25c851cc
Is there a calendar available for the weekly meetings during the course?,machine-learning-zoomcamp,25c851cc
Where can I access theoretical materials related to this machine learning course?,machine-learning-zoomcamp,25c851cc
Which platform should I use to ask questions for live sessions in Week 2?,machine-learning-zoomcamp,25c851cc
What visualization method can be used to analyze the distribution of data in a dataset?,machine-learning-zoomcamp,2ea26366
How can I load datasets for analysis using Python libraries?,machine-learning-zoomcamp,2ea26366
Which Python libraries can be employed to plot a histogram for exploratory data analysis?,machine-learning-zoomcamp,2ea26366
Is there a way to quantify the asymmetry of a distribution in a dataset?,machine-learning-zoomcamp,2ea26366
What specifics should I look at to understand the central tendency and dispersion of data points?,machine-learning-zoomcamp,2ea26366
What should I do if I encounter a Singular Matrix error in the machine learning for regression section?,machine-learning-zoomcamp,3aea6bcd
Why does the video lead to a Singular Matrix error when following along?,machine-learning-zoomcamp,3aea6bcd
Can attempting to invert X twice in my code cause a Singular Matrix error?,machine-learning-zoomcamp,3aea6bcd
Will the Regularization video help me understand why I get a Singular Matrix error?,machine-learning-zoomcamp,3aea6bcd
Is encountering a Singular Matrix error a normal part of learning in this section?,machine-learning-zoomcamp,3aea6bcd
Where can I find more information about the California housing dataset used in this course?,machine-learning-zoomcamp,719ff006
Is there a link where I can learn about the California housing dataset details?,machine-learning-zoomcamp,719ff006
How can I access a thorough description of the California housing dataset?,machine-learning-zoomcamp,719ff006
Can you provide a resource to understand the California housing dataset better?,machine-learning-zoomcamp,719ff006
Where should I go online to explore the California housing dataset information?,machine-learning-zoomcamp,719ff006
Why am I getting NaN values when using the mean function after calculating the root mean square error?,machine-learning-zoomcamp,f0766254
