question,course,document
On what date and time does the course commence?,data-engineering-zoomcamp,23cb47db
How can I subscribe to the course's public Google Calendar?,data-engineering-zoomcamp,23cb47db
What should I do to participate in the course before it begins?,data-engineering-zoomcamp,23cb47db
Where can I find announcements for the course?,data-engineering-zoomcamp,23cb47db
How can I join the course discussions on Slack?,data-engineering-zoomcamp,23cb47db
What should I complete before enrolling in this course?,data-engineering-zoomcamp,8d36ba77
Where can I find the necessary skills needed before starting the course?,data-engineering-zoomcamp,8d36ba77
What prior knowledge is required for this course?,data-engineering-zoomcamp,8d36ba77
Is there a list of prerequisites available for the course?,data-engineering-zoomcamp,8d36ba77
How can I check if I meet the course entry requirements?,data-engineering-zoomcamp,8d36ba77
Is it possible to enroll in the course after it begins?,data-engineering-zoomcamp,bc44dd09
Can I participate in the course without registering by the start date?,data-engineering-zoomcamp,bc44dd09
Am I eligible to submit homeworks if I join late?,data-engineering-zoomcamp,bc44dd09
Do I face deadlines if I join after the course starts?,data-engineering-zoomcamp,bc44dd09
Will I be able to submit my work even if I register late?,data-engineering-zoomcamp,bc44dd09
Is turning in assignments possible without a confirmation email?,data-engineering-zoomcamp,162ef410
When does learning and homework submission commence?,data-engineering-zoomcamp,162ef410
Is registration verification done before the course starts?,data-engineering-zoomcamp,162ef410
Will registering affect my ability to access course materials?,data-engineering-zoomcamp,162ef410
Is the confirmation email required for course participation?,data-engineering-zoomcamp,162ef410
What preparations are recommended before the course begins?,data-engineering-zoomcamp,ff75b05e
Which cloud account should be set up prior to starting?,data-engineering-zoomcamp,ff75b05e
What version of Python should be installed ahead of the course?,data-engineering-zoomcamp,ff75b05e
Is there a specific tool to manage infrastructure that should be installed?,data-engineering-zoomcamp,ff75b05e
How can I assess if I'm ready for the course topics?,data-engineering-zoomcamp,ff75b05e
How many Zoomcamps are offered in a year?,data-engineering-zoomcamp,e9407085
When does the Data-Engineering Zoomcamp typically occur?,data-engineering-zoomcamp,e9407085
Can I take a Zoomcamp at my own pace without joining a live cohort?,data-engineering-zoomcamp,e9407085
Are the Zoomcamps for different courses scheduled throughout the year?,data-engineering-zoomcamp,e9407085
Is there more than one live cohort for any Zoomcamp per year?,data-engineering-zoomcamp,e9407085
Is Mage AI being introduced in the 2024 cohort instead of Prefect or Airflow?,data-engineering-zoomcamp,85fa3299
Are the terraform videos updated for the current cohort?,data-engineering-zoomcamp,85fa3299
Was Prefect used in the 2023 course edition?,data-engineering-zoomcamp,85fa3299
What differences are there between the 2024 and 2023 cohorts?,data-engineering-zoomcamp,85fa3299
Has Airflow been replaced in the recent course versions?,data-engineering-zoomcamp,85fa3299
Will course materials be accessible after completion?,data-engineering-zoomcamp,c7b65a34
Can I review homework exercises once the course ends?,data-engineering-zoomcamp,c7b65a34
Is it possible to prepare for the next cohort after the course concludes?,data-engineering-zoomcamp,c7b65a34
Am I able to work on the capstone project after the course is over?,data-engineering-zoomcamp,c7b65a34
Can I learn at my own pace once the course is finished?,data-engineering-zoomcamp,c7b65a34
Can I still ask for help if I am enrolled in the self-paced version of the course?,data-engineering-zoomcamp,b9c2d732
What is the first step I should take if I have a question while taking the course?,data-engineering-zoomcamp,b9c2d732
Is the FAQ document the best place to find answers to my questions about the course?,data-engineering-zoomcamp,b9c2d732
Who or what can I tag for assistance with finding information in the slack channel?,data-engineering-zoomcamp,b9c2d732
Will the ZoomcampQABot always provide accurate answers to my questions?,data-engineering-zoomcamp,b9c2d732
Which playlist contains the main course videos on YouTube?,data-engineering-zoomcamp,f286b0ed
How can I find specific year videos like office hours?,data-engineering-zoomcamp,f286b0ed
Where can I access video thumbnails linking to the YouTube playlist?,data-engineering-zoomcamp,f286b0ed
Is there a year-specific YouTube playlist for additional resources?,data-engineering-zoomcamp,f286b0ed
Where is the main playlist for the course mentioned on Slack?,data-engineering-zoomcamp,f286b0ed
How many hours per week should I allocate to this course?,data-engineering-zoomcamp,fa0d2d83
What is the weekly time commitment for this course?,data-engineering-zoomcamp,fa0d2d83
Approximately how much time per week does this course require?,data-engineering-zoomcamp,fa0d2d83
What is the expected weekly workload for this course?,data-engineering-zoomcamp,fa0d2d83
How can I calculate the weekly hours needed for this course?,data-engineering-zoomcamp,fa0d2d83
Do I receive a certificate if I finish the course at my own pace?,data-engineering-zoomcamp,79ad19e7
Is a certificate available for completing the course individually?,data-engineering-zoomcamp,79ad19e7
Can I earn a certificate through self-paced study?,data-engineering-zoomcamp,79ad19e7
Will participating in a live cohort affect my certification eligibility?,data-engineering-zoomcamp,79ad19e7
Is peer-reviewing linked to receiving a course certificate?,data-engineering-zoomcamp,79ad19e7
Where can I find the video link for the Office Hour sessions?,data-engineering-zoomcamp,fdbd13a1
How do students ask questions during the workshop sessions?,data-engineering-zoomcamp,fdbd13a1
Where will the video URL be posted before Office Hour sessions start?,data-engineering-zoomcamp,fdbd13a1
Can students use the chat to post questions during the Live sessions?,data-engineering-zoomcamp,fdbd13a1
How do students join the Office Hour sessions if the zoom link is not available to them?,data-engineering-zoomcamp,fdbd13a1
Will the Office Hours sessions be recorded if I miss them?,data-engineering-zoomcamp,b87b36aa
Can I watch the Office Hours recordings if I can't attend live?,data-engineering-zoomcamp,b87b36aa
What happens if I miss the live workshop or Office Hours?,data-engineering-zoomcamp,b87b36aa
Are recordings of the Office Hours available after the session?,data-engineering-zoomcamp,b87b36aa
Is it possible to rewatch the Office Hours if I can't make it?,data-engineering-zoomcamp,b87b36aa
Where can I find the most current deadlines for homework and projects in this course?,data-engineering-zoomcamp,39ee5beb
What should I check for any possible extensions to homework deadlines?,data-engineering-zoomcamp,39ee5beb
Where can I see the updated deadlines if any changes are made by the instructors?,data-engineering-zoomcamp,39ee5beb
Is there a way to see the updated deadlines directly in a form if they have been changed?,data-engineering-zoomcamp,39ee5beb
Who should I follow for announcements regarding changes in deadlines?,data-engineering-zoomcamp,39ee5beb
Are students permitted to submit homework past the deadline?,data-engineering-zoomcamp,bc584fb1
Can I still send in my homework if the due date has passed?,data-engineering-zoomcamp,bc584fb1
Is it possible to submit assignments late without a penalty?,data-engineering-zoomcamp,bc584fb1
What should I do if I am trying to submit my homework after the due date?,data-engineering-zoomcamp,bc584fb1
How can I verify that my late homework submission has been received?,data-engineering-zoomcamp,bc584fb1
What is the URL for the homework link?,data-engineering-zoomcamp,cc7bc13b
Where can I find my homework repository?,data-engineering-zoomcamp,cc7bc13b
How do I submit my coding exercises?,data-engineering-zoomcamp,cc7bc13b
Where should I upload my weekly assignments?,data-engineering-zoomcamp,cc7bc13b
Is it okay to use GitLab for homework submissions?,data-engineering-zoomcamp,cc7bc13b
How is my homework graded in terms of points on the course management platform?,data-engineering-zoomcamp,70572980
Where can I view my total points accumulated in the course?,data-engineering-zoomcamp,70572980
What point system is used for submissions to the FAQ section?,data-engineering-zoomcamp,70572980
How is Learning in Public encouraged through the course's point system?,data-engineering-zoomcamp,70572980
What contributes to the sum of all points on the leaderboard?,data-engineering-zoomcamp,70572980
How can I find out what my display name is on the leaderboard?,data-engineering-zoomcamp,7cb165f5
What steps do I need to follow to view and change my display name?,data-engineering-zoomcamp,7cb165f5
"Why am I not appearing on the leaderboard, and how can I verify my assigned name?",data-engineering-zoomcamp,7cb165f5
Where do I log in to see which name has been assigned to me on the leaderboard?,data-engineering-zoomcamp,7cb165f5
"Is it possible to change the random name assigned to me, and if so, how can I do it?",data-engineering-zoomcamp,7cb165f5
What is the recommended Python version for the course in 2024?,data-engineering-zoomcamp,b45f363b
Is it okay to use Python 3.10 or 3.11 for this course?,data-engineering-zoomcamp,b45f363b
Why is Python 3.9 suggested for troubleshooting against videos?,data-engineering-zoomcamp,b45f363b
Does Python 3.11 provide compatibility for this course?,data-engineering-zoomcamp,b45f363b
Can I use Python versions newer than 3.9?,data-engineering-zoomcamp,b45f363b
What should I consider if I want to set up my work environment using my local machine?,data-engineering-zoomcamp,9ea16c66
What are the challenges Windows users might face when setting up a local environment?,data-engineering-zoomcamp,9ea16c66
Is there specific guidance for setting up a virtual machine environment for the course?,data-engineering-zoomcamp,9ea16c66
Why might someone choose to work on a cloud-based virtual machine instead of a local machine?,data-engineering-zoomcamp,9ea16c66
What options are available for creating a consistent work environment across different computers?,data-engineering-zoomcamp,9ea16c66
Can I use GitHub Codespaces instead of CLI/Git Bash for data ingestion?,data-engineering-zoomcamp,e6d9c690
Does GitHub Codespaces provide Linux resources for computing?,data-engineering-zoomcamp,e6d9c690
Are there pre-installed tools available in GitHub Codespaces?,data-engineering-zoomcamp,e6d9c690
Can I open my repositories in a GitHub Codespace?,data-engineering-zoomcamp,e6d9c690
Is Docker pre-installed in GitHub Codespaces?,data-engineering-zoomcamp,e6d9c690
Can I choose my preferred platform for the course instead of using GitHub codespaces?,data-engineering-zoomcamp,f6cfe45b
Is using GCP VM mandatory for completing the course tasks?,data-engineering-zoomcamp,f6cfe45b
Am I allowed to work through the course on my personal laptop instead of suggested environments?,data-engineering-zoomcamp,f6cfe45b
Do I need to install specific software other than PostgreSQL and Docker for the course?,data-engineering-zoomcamp,f6cfe45b
Are there alternatives to GitHub codespaces for the course environment setup?,data-engineering-zoomcamp,f6cfe45b
Is it necessary to use both GitHub Codespaces and GCP for this course?,data-engineering-zoomcamp,411f1f68
Should I focus on learning BigQuery for this course?,data-engineering-zoomcamp,411f1f68
Can a local environment be set up for this course instead of using GitHub Codespaces or GCP?,data-engineering-zoomcamp,411f1f68
Which environment should I choose for my end project between GitHub Codespaces and GCP?,data-engineering-zoomcamp,411f1f68
Will BigQuery be an essential part of the course activities?,data-engineering-zoomcamp,411f1f68
What step is needed to access the Run command window on a Windows machine?,data-engineering-zoomcamp,2dbaabaa
How do you access the Registry Editor on Windows?,data-engineering-zoomcamp,2dbaabaa
Which registry value must be changed to solve the connection issue with a GCP VM?,data-engineering-zoomcamp,2dbaabaa
Where is the known_hosts file located on a Windows machine?,data-engineering-zoomcamp,2dbaabaa
What alternative method can be used to solve the connection issue instead of editing the registry?,data-engineering-zoomcamp,2dbaabaa
Why is the course emphasizing the use of GCP for cloud services?,data-engineering-zoomcamp,00a4c0ea
"Is it mandatory to use GCP for the assignments, or can I choose another provider?",data-engineering-zoomcamp,00a4c0ea
What benefits does GCP offer to new users that are relevant for this course?,data-engineering-zoomcamp,00a4c0ea
Are there specific services or tools within GCP that we will focus on during the course?,data-engineering-zoomcamp,00a4c0ea
What is required to sign up for a free GCP account?,data-engineering-zoomcamp,00a4c0ea
Is payment required for GCP when using the free trial?,data-engineering-zoomcamp,5856711b
Do I have to pay for cloud services if I use GCP's free trial?,data-engineering-zoomcamp,5856711b
Can I access GCP without any charges initially?,data-engineering-zoomcamp,5856711b
Is there a cost involved with using the GCP free trial for this course?,data-engineering-zoomcamp,5856711b
Will GCP charge me during the free trial period for this course?,data-engineering-zoomcamp,5856711b
Is it necessary to use GCP or any cloud providers for this course?,data-engineering-zoomcamp,50463851
Can I run all course materials locally without using a cloud provider?,data-engineering-zoomcamp,50463851
Is there a local alternative for everything taught in the course?,data-engineering-zoomcamp,50463851
Are there any course components that cannot be executed without GCP?,data-engineering-zoomcamp,50463851
Can I complete the course successfully without access to BigQuery?,data-engineering-zoomcamp,50463851
Can I choose an alternative environment like AWS instead of the standard one provided in the course?,data-engineering-zoomcamp,7835b504
What should I keep in mind if I decide to use AWS for the course tasks and projects?,data-engineering-zoomcamp,7835b504
Will the final capstone evaluation differ if I choose to use AWS instead of GCP?,data-engineering-zoomcamp,7835b504
"How can I get assistance if I encounter issues while using AWS, given it's less commonly used in the course?",data-engineering-zoomcamp,7835b504
Is it possible to use different tools apart from the ones suggested in the course?,data-engineering-zoomcamp,7835b504
When will live Zoom calls other than the Office Hour occur during the course?,data-engineering-zoomcamp,c164e19b
Are there any scheduled live calls apart from the Office Hour?,data-engineering-zoomcamp,c164e19b
Is there a chance for additional live sessions besides the Office Hour?,data-engineering-zoomcamp,c164e19b
Will live calls be planned during the Capstone period?,data-engineering-zoomcamp,c164e19b
How will students be informed about extra live Zoom calls?,data-engineering-zoomcamp,c164e19b
Are we using NYC Trip data for the same project as last year?,data-engineering-zoomcamp,4b7a97e4
Will the data for our project change compared to last year?,data-engineering-zoomcamp,4b7a97e4
Is the 2022 data being used for this year's project?,data-engineering-zoomcamp,4b7a97e4
Which year's NYC Trip data is being used for the project?,data-engineering-zoomcamp,4b7a97e4
Does this year's project require new data or the same as last year?,data-engineering-zoomcamp,4b7a97e4
Has the information from 2022 been removed entirely?,data-engineering-zoomcamp,eb582022
Is there a way to access the 2022 repository content?,data-engineering-zoomcamp,eb582022
Was the 2022 course repository eliminated?,data-engineering-zoomcamp,eb582022
Can I still find the 2022 materials somewhere?,data-engineering-zoomcamp,eb582022
Has the 2022 content been relocated?,data-engineering-zoomcamp,eb582022
Can I choose a different tool for my project?,data-engineering-zoomcamp,2dee5302
Is it permitted to work with any software for my assignment?,data-engineering-zoomcamp,2dee5302
Am I allowed to employ tools other than those taught?,data-engineering-zoomcamp,2dee5302
May I integrate different technologies for my project work?,data-engineering-zoomcamp,2dee5302
Is there flexibility in selecting project tools?,data-engineering-zoomcamp,2dee5302
Can I use Airflow as an alternative to the tools in this course?,data-engineering-zoomcamp,90409ca4
Is it acceptable to opt for AWS instead of using GCP products in this course?,data-engineering-zoomcamp,90409ca4
Am I allowed to choose Tableau in place of Metabase or Google Data Studio for this course?,data-engineering-zoomcamp,90409ca4
"If I opt for a different tool, how would this affect the support provided during the course?",data-engineering-zoomcamp,90409ca4
Would I need to justify my choice of tools for my capstone project if I use alternatives?,data-engineering-zoomcamp,90409ca4
How can I support the course?,data-engineering-zoomcamp,d3abee4c
What steps can I take if I want to enhance the course material?,data-engineering-zoomcamp,d3abee4c
Is there a way to share the course with others effectively?,data-engineering-zoomcamp,d3abee4c
How can I make a direct improvement to the course content?,data-engineering-zoomcamp,d3abee4c
What actions are recommended to help promote this course?,data-engineering-zoomcamp,d3abee4c
Is it important which operating system I use for this course?,data-engineering-zoomcamp,f3513aa7
"Can the course materials be accessed on Linux, Windows, or macOS?",data-engineering-zoomcamp,f3513aa7
Will using a different OS affect my performance in the course?,data-engineering-zoomcamp,f3513aa7
Did previous students have any issues with their operating systems in this course?,data-engineering-zoomcamp,f3513aa7
"Is Linux required, or can I use Windows or Mac for the course?",data-engineering-zoomcamp,f3513aa7
What can Windows users do when they encounter roadblocks with *.sh scripts in the course modules?,data-engineering-zoomcamp,bf869e91
Why is using WSL recommended for Windows users in this course?,data-engineering-zoomcamp,bf869e91
Where can Windows users find information on overcoming issues with shell scripts in later modules?,data-engineering-zoomcamp,bf869e91
What challenges might Windows users face if they use git bash or MINGW64 for *.sh files?,data-engineering-zoomcamp,bf869e91
How do previous students manage to work with shell scripts on Windows?,data-engineering-zoomcamp,bf869e91
What extra materials could we use for this course?,data-engineering-zoomcamp,e21fa8ea
Where can I find books you suggest for this topic?,data-engineering-zoomcamp,e21fa8ea
Is there a list of resources I should consult?,data-engineering-zoomcamp,e21fa8ea
Do you have any recommended reading for the course?,data-engineering-zoomcamp,e21fa8ea
Are there any links to helpful documents or resources?,data-engineering-zoomcamp,e21fa8ea
Can I try submitting the project again if I miss the first deadline?,data-engineering-zoomcamp,11e1538a
What happens if I fail my first project submission?,data-engineering-zoomcamp,11e1538a
Is there an option to submit the project twice?,data-engineering-zoomcamp,11e1538a
How many chances do I get to submit the project?,data-engineering-zoomcamp,11e1538a
"If I don't succeed on the first project try, what are my options?",data-engineering-zoomcamp,11e1538a
What is the first step I should take when trying to troubleshoot an issue?,data-engineering-zoomcamp,08e91669
How can I effectively use online resources to solve a problem on my own?,data-engineering-zoomcamp,08e91669
What should I do if reinstalling an application does not resolve my issue?,data-engineering-zoomcamp,08e91669
How should I format my code when posting questions for troubleshooting help?,data-engineering-zoomcamp,08e91669
What should I do if I need to take a break from solving a technology-related problem?,data-engineering-zoomcamp,08e91669
When should I consider asking a question if the troubleshooting guide doesn't help?,data-engineering-zoomcamp,51d6410f
What details should I include about the system I'm coding on when asking a question?,data-engineering-zoomcamp,51d6410f
Which video or command details are important to mention in my question?,data-engineering-zoomcamp,51d6410f
What specific error information should be included in my question?,data-engineering-zoomcamp,51d6410f
Why is it crucial to mention what I've tried that didn't work when asking a question?,data-engineering-zoomcamp,51d6410f
What steps should I follow to clone the course repository from GitHub to my computer?,data-engineering-zoomcamp,f7284ef8
Can I add my own notes or modifications to the instructors' code in the course repository?,data-engineering-zoomcamp,f7284ef8
Where can I find a tutorial on setting up my own repositories for my notes and file versions?,data-engineering-zoomcamp,f7284ef8
What types of files should be ignored in a GitHub repository for this course?,data-engineering-zoomcamp,f7284ef8
Are there specific security considerations for storing sensitive information on GitHub?,data-engineering-zoomcamp,f7284ef8
How can I fix the missing separator error in my Makefile?,data-engineering-zoomcamp,de758bbb
What should I do if my Makefile shows a missing separator error?,data-engineering-zoomcamp,de758bbb
What error might occur if spaces are used instead of tabs in a Makefile?,data-engineering-zoomcamp,de758bbb
What is a common solution to the missing separator issue in Makefiles?,data-engineering-zoomcamp,de758bbb
How can converting spaces to tabs resolve an error in my Makefile?,data-engineering-zoomcamp,de758bbb
How can I open an HTML file from Linux on WSL 2 with a Windows browser?,data-engineering-zoomcamp,a6931036
What command do I use to open an HTML file in a Windows browser from Linux on WSL?,data-engineering-zoomcamp,a6931036
How do I set a specific browser to open HTML files using wslview in WSL?,data-engineering-zoomcamp,a6931036
Which package needs to be installed to open HTML files in Windows browsers from Linux on WSL?,data-engineering-zoomcamp,a6931036
Can I use Firefox to open HTML files from Linux on WSL and how do I set it as the default browser?,data-engineering-zoomcamp,a6931036
How do I set up Chrome Remote Desktop on a Debian Linux VM in Compute Engine?,data-engineering-zoomcamp,a5e2f1c5
What solution is available if I encounter a 403 Forbidden error when downloading 2021 Yellow Taxi Trip Records?,data-engineering-zoomcamp,a5e2f1c5
Which tool should I use to unzip a 'gz' file on a command line?,data-engineering-zoomcamp,a5e2f1c5
Where can I find the backup data for the 2021 Yellow Taxi Trip Records?,data-engineering-zoomcamp,a5e2f1c5
What errors might occur when trying to download taxi data from the TLC website?,data-engineering-zoomcamp,a5e2f1c5
What is the issue with storing taxi data files when using the csv.gz extension instead of csv?,data-engineering-zoomcamp,c285f55b
How can we obtain the correct file name for taxi data from the URL?,data-engineering-zoomcamp,c285f55b
What is a recommended alternative to changing the file extension of taxi data files from csv.gz to csv?,data-engineering-zoomcamp,c285f55b
Why can pandas' read_csv handle file names with the csv.gz extension without issues?,data-engineering-zoomcamp,c285f55b
What needs to be done to the csv_name variable to correctly read taxi data files from the URL?,data-engineering-zoomcamp,c285f55b
Where can I find the data dictionary for Yellow Taxi trip records?,data-engineering-zoomcamp,f7a1d027
What is the link to the data dictionary for Green Taxi trips?,data-engineering-zoomcamp,f7a1d027
Where is the data dictionary for New York Yellow Taxi data available?,data-engineering-zoomcamp,f7a1d027
How can I access the document detailing Green Taxi trip record fields?,data-engineering-zoomcamp,f7a1d027
Where do I get the description file for Yellow Taxi trip records?,data-engineering-zoomcamp,f7a1d027
How can I unzip a downloaded parquet file using the command line?,data-engineering-zoomcamp,120570c1
What command do I use to convert a parquet file to a CSV in Python?,data-engineering-zoomcamp,120570c1
Where do I add the line that defines the parquet file name in the ingest_data.py script?,data-engineering-zoomcamp,120570c1
What changes should I make to the code that downloads files in the ingest_data.py script?,data-engineering-zoomcamp,120570c1
How do I ensure the CSV file name aligns with the rest of the code after converting from parquet?,data-engineering-zoomcamp,120570c1
How should I install wget on Ubuntu if it's not recognized as a command?,data-engineering-zoomcamp,405f99c5
What is the process to install wget on macOS?,data-engineering-zoomcamp,405f99c5
"If wget is not recognized on Windows, what are the steps to install it using Chocolatey?",data-engineering-zoomcamp,405f99c5
How can I install wget on Windows without using Chocolatey?,data-engineering-zoomcamp,405f99c5
"Is there a Python alternative to wget, and how do I use it?",data-engineering-zoomcamp,405f99c5
What should I do if I see an error about verifying a website certificate with wget on MacOS?,data-engineering-zoomcamp,2bfee96f
How can I run a wget command in Jupyter Notebook without running into certificate errors?,data-engineering-zoomcamp,2bfee96f
What addition should be made to wget commands when encountering certificate errors in the CLI?,data-engineering-zoomcamp,2bfee96f
How to use Python to bypass wget certificate verification issues?,data-engineering-zoomcamp,2bfee96f
Which flag can be added to wget to ignore certificate checking errors?,data-engineering-zoomcamp,2bfee96f
How can I use the backslash as an escape character in Git Bash for Windows as Alexey does?,data-engineering-zoomcamp,7d587f09
