question,course,document
What should I do if I get an error about a missing scipy module in my Saturn Cloud TensorFlow Jupyter server?,machine-learning-zoomcamp,773c776a
How can I ensure scipy is installed by default when I create a Jupyter server resource in Saturn Cloud with a TensorFlow image?,machine-learning-zoomcamp,773c776a
What is the procedure for adding scipy as an extra package in Saturn Cloud's TensorFlow image setup?,machine-learning-zoomcamp,773c776a
"If I want scipy installed automatically upon resource startup in Saturn Cloud, how should I configure the Jupyter server resource?",machine-learning-zoomcamp,773c776a
What is an efficient way to upload large Kaggle datasets to Saturn Cloud?,machine-learning-zoomcamp,23058faf
How can I set up my Kaggle account to access datasets on Saturn Cloud?,machine-learning-zoomcamp,23058faf
What steps are needed to create a new API token on Kaggle?,machine-learning-zoomcamp,23058faf
Where should I upload the kaggle.json file in Saturn Cloud?,machine-learning-zoomcamp,23058faf
How do I download and unzip a specific Kaggle dataset in Saturn Cloud?,machine-learning-zoomcamp,23058faf
What do I need to run TensorFlow with GPU on Ubuntu 22.04?,machine-learning-zoomcamp,c138d956
How can I simplify the installation of GPU tools for TensorFlow?,machine-learning-zoomcamp,c138d956
What tools are necessary for setting up TensorFlow GPU support on a local machine?,machine-learning-zoomcamp,c138d956
Who provides a simplified guide for CUDA and cuDNN setup?,machine-learning-zoomcamp,c138d956
Why might the CUDA and cuDNN installation process feel overwhelming?,machine-learning-zoomcamp,c138d956
What should I do if I encounter a ValueError related to loading weights in a subclassed Model?,machine-learning-zoomcamp,f650f7c6
How can I resolve the issue of weights not loading from an HDF5 file in a subclassed Model?,machine-learning-zoomcamp,f650f7c6
Why does my model give a ValueError when loading weights that are saved in HDF5 format?,machine-learning-zoomcamp,f650f7c6
What is the solution for the error when loading model weights into a subclassed Model?,machine-learning-zoomcamp,f650f7c6
How do I fit a subclassed Model so it can properly load weights from an HDF5 file?,machine-learning-zoomcamp,f650f7c6
What is the error message when trying to connect to Git on Saturn Cloud?,machine-learning-zoomcamp,9b0b93db
How can I configure Git in Saturn Cloud without getting a permission denied error?,machine-learning-zoomcamp,9b0b93db
What alternative method can be used to set up Git in Saturn Cloud?,machine-learning-zoomcamp,9b0b93db
Where can I find a tutorial for setting up Git in Saturn Cloud?,machine-learning-zoomcamp,9b0b93db
Who added the solution for setting up Git in Saturn Cloud in the FAQ record?,machine-learning-zoomcamp,9b0b93db
What error is described when trying to clone the clothing dataset using SSH?,machine-learning-zoomcamp,26bba07f
How can I resolve a host key verification failure when cloning a repository?,machine-learning-zoomcamp,26bba07f
What cloning method should I use if my SSH key is not configured properly?,machine-learning-zoomcamp,26bba07f
Who added the solution to the host key verification failure problem?,machine-learning-zoomcamp,26bba07f
What is the result when attempting to clone a repository with an unconfigured SSH key?,machine-learning-zoomcamp,26bba07f
Why does accuracy and loss remain unchanged during training in neural networks?,machine-learning-zoomcamp,4bbc5548
What could cause the accuracy and loss metrics to remain nearly the same throughout the training process?,machine-learning-zoomcamp,4bbc5548
How should class_mode be configured when training a neural network in the homework?,machine-learning-zoomcamp,4bbc5548
What settings might cause issues with constant accuracy and loss in neural network training?,machine-learning-zoomcamp,4bbc5548
Who contributed the solution regarding unchanged accuracy and loss during training?,machine-learning-zoomcamp,4bbc5548
What should be checked if the model experiences high loss and poor accuracy after augmentation?,machine-learning-zoomcamp,b7e16f53
What could cause the loss to increase significantly during the first epoch after resuming training?,machine-learning-zoomcamp,b7e16f53
How can a model's accuracy dropping to around 0.5 after augmentation be addressed?,machine-learning-zoomcamp,b7e16f53
What is the solution if the model performs like a random guess post-augmentation?,machine-learning-zoomcamp,b7e16f53
Which option in the ImageDataGenerator should be confirmed during augmentation troubleshooting?,machine-learning-zoomcamp,b7e16f53
What should I do if I encounter a missing channel value error when reloading a model in TensorFlow?,machine-learning-zoomcamp,b0b7f7ad
How can specifying the number of channels in the Input layer help when saving and reloading models in Keras?,machine-learning-zoomcamp,b0b7f7ad
Why does a reloaded model complain about the number of channels when not defined explicitly during model architecture creation?,machine-learning-zoomcamp,b0b7f7ad
Which part of the model architecture needs modification to avoid the ValueError related to the channel dimension when reloading?,machine-learning-zoomcamp,b0b7f7ad
What does specifying number of channels in the input shape prevent when handling model architectures in TensorFlow?,machine-learning-zoomcamp,b0b7f7ad
How can I extract an image dataset from a zipped folder without seeing many unzipping messages in Jupyter Notebook?,machine-learning-zoomcamp,9d7f93cb
What method should I use inside a Jupyter Notebook to suppress unzipping output in a command line operation?,machine-learning-zoomcamp,9d7f93cb
What is the solution for handling a large amount of output messages when unzipping a folder in a notebook?,machine-learning-zoomcamp,9d7f93cb
Which command in a Jupyter Notebook can help me avoid output messages when unzipping a dataset?,machine-learning-zoomcamp,9d7f93cb
Can you provide a way to unzip a folder within Jupyter Notebook suppressing the output details?,machine-learning-zoomcamp,9d7f93cb
questions,machine-learning-zoomcamp,d3ed26be
What should I do if I encounter a missing scipy module error in SaturnCloud with Tensorflow?,machine-learning-zoomcamp,617b7c6b
How can I resolve a scipy module error when fitting a model in SaturnCloud?,machine-learning-zoomcamp,617b7c6b
What steps are necessary to fix a missing scipy module issue in a SaturnCloud environment?,machine-learning-zoomcamp,617b7c6b
What actions should I take if there's an error regarding scipy when using SaturnCloud with Tensorflow?,machine-learning-zoomcamp,617b7c6b
How do I fix the problem of the missing scipy module in a new SaturnCloud environment?,machine-learning-zoomcamp,617b7c6b
What determines the order of numeric class labels when using flow_from_directory with binary class mode?,machine-learning-zoomcamp,82a5ccaf
How does a binary Keras model predict probabilities when using a sigmoid activation function?,machine-learning-zoomcamp,82a5ccaf
"In the flow_from_directory process, what will be the class label of a folder named 'dragon' if 'dino' is the other folder?",machine-learning-zoomcamp,82a5ccaf
What is the meaning of a single probability prediction in a binary classification Keras model?,machine-learning-zoomcamp,82a5ccaf
How is the probability for class 0 calculated in a binary Keras model prediction when sigmoid activation is used?,machine-learning-zoomcamp,82a5ccaf
How critical are the predicted actual values when a neural network makes a prediction?,machine-learning-zoomcamp,e967f22f
Should the predicted values from a neural network be interpreted as likelihoods for classification purposes?,machine-learning-zoomcamp,e967f22f
Is it a problem if the predicted values from a neural network show slight variations?,machine-learning-zoomcamp,e967f22f
Do minor changes in predicted values from a neural network affect the validity of the model's prediction?,machine-learning-zoomcamp,e967f22f
Can the predicted values from neural networks be used directly to assess class membership?,machine-learning-zoomcamp,e967f22f
What should I do if my reported accuracy with the wasp/bee model differs from the HW?,machine-learning-zoomcamp,4ed90351
How can I resolve a discrepancy in std training loss on different devices for the wasp/bee model?,machine-learning-zoomcamp,4ed90351
Why might my mac laptop show different results for accuracy and loss with the SGD optimizer?,machine-learning-zoomcamp,4ed90351
What platform was suggested to get results closer to the HW for my neural network model?,machine-learning-zoomcamp,4ed90351
How can changing the runtime to T4 help with model performance compared to CPU?,machine-learning-zoomcamp,4ed90351
How can I speed up data loading when using model.fit in neural networks?,machine-learning-zoomcamp,61de98b5
What parameter should I adjust to improve data generation speeds in model.fit?,machine-learning-zoomcamp,61de98b5
What is the default worker value when using model.fit for data generation?,machine-learning-zoomcamp,61de98b5
Where can I find detailed documentation on model.fit for neural networks?,machine-learning-zoomcamp,61de98b5
Who contributed the information on using multi-threading in model.fit?,machine-learning-zoomcamp,61de98b5
How can I achieve reproducibility in my TensorFlow training runs?,machine-learning-zoomcamp,4b1511a9
What method ensures reproducibility when using TensorFlow for multiple executions?,machine-learning-zoomcamp,4b1511a9
Which code snippets should I include to make my TensorFlow model runs reproducible?,machine-learning-zoomcamp,4b1511a9
What is the role of setting a random seed in TensorFlow?,machine-learning-zoomcamp,4b1511a9
Who contributed the information on reproducibility with TensorFlow in the course material?,machine-learning-zoomcamp,4b1511a9
Can we submit assignments using pytorch instead of keras?,machine-learning-zoomcamp,2a23aa60
Is it possible to use another framework like pytorch in the lessons?,machine-learning-zoomcamp,2a23aa60
Where can I find a guide to creating a CNN with pytorch?,machine-learning-zoomcamp,2a23aa60
Does pytorch offer similar functionality for neural networks compared to keras?,machine-learning-zoomcamp,2a23aa60
Who should I contact if I want to make a pull request with pytorch work for the course?,machine-learning-zoomcamp,2a23aa60
Why does training a Keras model sometimes result in a 'Failed to find data adapter' error?,machine-learning-zoomcamp,4806c765
What might cause a 'Failed to find data adapter' error when using ImageDataGenerator in Keras?,machine-learning-zoomcamp,4806c765
"When training a Keras model, what is a common error involving ImageDataGenerator input?",machine-learning-zoomcamp,4806c765
What should be used in the model.fit() function to prevent a 'Failed to find data adapter' error?,machine-learning-zoomcamp,4806c765
Who added the solution to the 'Failed to find data adapter' error in the FAQ?,machine-learning-zoomcamp,4806c765
How can I repeatedly run nvidia-smi without using the watch command in section 8?,machine-learning-zoomcamp,54edf2e9
Which built-in option allows nvidia-smi to update itself every few seconds?,machine-learning-zoomcamp,54edf2e9
How can I configure nvidia-smi to update its output every N seconds without external tools?,machine-learning-zoomcamp,54edf2e9
What command allows nvidia-smi to automatically update every 2 seconds?,machine-learning-zoomcamp,54edf2e9
Who added the information about nvidia-smi's built-in looping function?,machine-learning-zoomcamp,54edf2e9
How can I interactively view GPU processes?,machine-learning-zoomcamp,9208cc09
What tool is similar to 'htop' for monitoring GPU usage?,machine-learning-zoomcamp,9208cc09
Which Python package allows checking GPU utilization?,machine-learning-zoomcamp,9208cc09
Where can I find the image source for the GPU process viewer?,machine-learning-zoomcamp,9208cc09
Who contributed the information about GPU process monitoring?,machine-learning-zoomcamp,9208cc09
How is the parameter count of 896 derived for the Conv2D layer in the neural network?,machine-learning-zoomcamp,c7b52c96
What factors contribute to the calculation of parameters in a Conv2D layer?,machine-learning-zoomcamp,c7b52c96
Can you explain why the Flatten layer results in 6272 features?,machine-learning-zoomcamp,c7b52c96
How do the dimensions and filters in layers affect the output shape in neural networks?,machine-learning-zoomcamp,c7b52c96
What is the calculation method for determining the output shape of the Flatten layer in a model?,machine-learning-zoomcamp,c7b52c96
What type of model does the course describe as a plain stack of layers with one input and one output tensor each?,machine-learning-zoomcamp,d624d36e
Which Keras model API might be easier to use for the homework when recreating a full model from scratch?,machine-learning-zoomcamp,d624d36e
In which scenario might the more complicated Functional Model API be beneficial according to the course?,machine-learning-zoomcamp,d624d36e
What advice is given regarding correcting an error in the neural net architecture during a fresh run?,machine-learning-zoomcamp,d624d36e
"Where can I find a useful example of a Sequential model, specifically related to the 'Bee or Wasp' dataset?",machine-learning-zoomcamp,d624d36e
How can I solve out of memory errors when using TensorFlow on an Nvidia GPU?,machine-learning-zoomcamp,90eea9b5
What code snippet can help with OOM errors on TensorFlow for Nvidia GPUs?,machine-learning-zoomcamp,90eea9b5
Is there a fix available for out of memory errors in TensorFlow with a GPU?,machine-learning-zoomcamp,90eea9b5
How do I set memory growth to fix OOM issues on an Nvidia GPU in TensorFlow?,machine-learning-zoomcamp,90eea9b5
Have you found a solution for fixing out of memory errors in TensorFlow on GPUs?,machine-learning-zoomcamp,90eea9b5
How can I speed up model training on Google Colab with a T4 GPU?,machine-learning-zoomcamp,c8cb0d5f
What default value should I change to improve training speed on Colab?,machine-learning-zoomcamp,c8cb0d5f
How many workers did someone use for a free T4 GPU on Colab?,machine-learning-zoomcamp,c8cb0d5f
Where can I find information on optimizing GPU core usage on Colab?,machine-learning-zoomcamp,c8cb0d5f
Who provided the solution for slow model training in Google Colab?,machine-learning-zoomcamp,c8cb0d5f
What new method is recommended for loading images instead of ImageDataGenerator?,machine-learning-zoomcamp,f7c155a6
What alternative does the keras documentation suggest over ImageDataGenerator for new code?,machine-learning-zoomcamp,f7c155a6
Why is ImageDataGenerator not advised for new projects?,machine-learning-zoomcamp,f7c155a6
What is the preferred approach to load and transform images according to the keras documentation?,machine-learning-zoomcamp,f7c155a6
Where can I find more details on loading and augmenting images as per keras guidelines?,machine-learning-zoomcamp,f7c155a6
How can I approach the initial steps for Week 9?,machine-learning-zoomcamp,e958ffd0
What should I do to initiate Week 9's activities?,machine-learning-zoomcamp,e958ffd0
Where should I begin with the Week 9 content?,machine-learning-zoomcamp,e958ffd0
What are the first steps to start Week 9?,machine-learning-zoomcamp,e958ffd0
Can you guide me in starting with the tasks for Week 9?,machine-learning-zoomcamp,e958ffd0
Where can I find the model for the ninth week?,machine-learning-zoomcamp,0137aaa4
Where is the location for the week 9 model now?,machine-learning-zoomcamp,0137aaa4
How can I access the model we need for week 9?,machine-learning-zoomcamp,0137aaa4
Where do I download week 9 models from now?,machine-learning-zoomcamp,0137aaa4
What is the updated URL for the ninth week's model?,machine-learning-zoomcamp,0137aaa4
Why does the command echo ${REMOTE_URI} not display anything when I run it?,machine-learning-zoomcamp,5aa1a659
What should I do to display the URI address when echo ${REMOTE_URI} returns nothing?,machine-learning-zoomcamp,5aa1a659
How can I assign a URI address to the REMOTE_URI variable in the terminal?,machine-learning-zoomcamp,5aa1a659
What is a workaround for echo ${REMOTE_URI} issues on Ubuntu?,machine-learning-zoomcamp,5aa1a659
What is the main difference in using echo $REMOTE_URI compared to the method in video 9.6?,machine-learning-zoomcamp,5aa1a659
What should I do if I encounter a syntax error when retrieving the password using aws-cli?,machine-learning-zoomcamp,965e7ae8
What command should replace aws ecr get-login --no-include-email to solve the invalid choice error?,machine-learning-zoomcamp,965e7ae8
Can you suggest how to streamline the AWS login process for docker image repositories?,machine-learning-zoomcamp,965e7ae8
How can I modify the login command for my AWS account and region when using docker?,machine-learning-zoomcamp,965e7ae8
Who provided the solution for serverless deep learning login errors covered in section 9?,machine-learning-zoomcamp,965e7ae8
question1,machine-learning-zoomcamp,d9d4790c
question2,machine-learning-zoomcamp,d9d4790c
question3,machine-learning-zoomcamp,d9d4790c
question4,machine-learning-zoomcamp,d9d4790c
question5,machine-learning-zoomcamp,d9d4790c
What error might occur when building a docker image from the Amazon python base image in a serverless deep learning context?,machine-learning-zoomcamp,94ea5a66
How can updating Docker Desktop help when facing an error while building a docker image?,machine-learning-zoomcamp,94ea5a66
"If restarting Docker Desktop doesn't resolve the docker image error, what should be attempted next?",machine-learning-zoomcamp,94ea5a66
What command could be used if the initial steps fail to solve the error when building a docker image?,machine-learning-zoomcamp,94ea5a66
Who added the optional solution for the docker image error in the serverless deep learning section?,machine-learning-zoomcamp,94ea5a66
What alternative command can Windows users run in Jupyter Notebook instead of '!ls -lh'?,machine-learning-zoomcamp,503ffcd0
Why does the 'ls' command generate an error in a Windows Jupyter Notebook?,machine-learning-zoomcamp,503ffcd0
How can I get a similar output to '!ls -lh' in Windows?,machine-learning-zoomcamp,503ffcd0
What message appears when '!ls -lh' is not recognized in a Windows environment?,machine-learning-zoomcamp,503ffcd0
Who provided the solution for the 'ls' command error in Jupyter Notebook?,machine-learning-zoomcamp,503ffcd0
What does the error message ImportError: generic_type: type 'InterpreterWrapper' is already registered indicate when running tflite code?,machine-learning-zoomcamp,ca207f01
How can I resolve the ImportError issue when using tflite_runtime.interpreter and tensorflow together?,machine-learning-zoomcamp,ca207f01
Why do I encounter an ImportError related to InterpreterWrapper while using TensorFlow and tflite?,machine-learning-zoomcamp,ca207f01
What steps should I take to fix the kernel error caused by importing tensorflow and tflite_runtime.interpreter together?,machine-learning-zoomcamp,ca207f01
How should I import tflite_runtime.interpreter to avoid the InterpreterWrapper registration error?,machine-learning-zoomcamp,ca207f01
Why might I encounter the message about Windows version not being up-to-date when using Docker?,machine-learning-zoomcamp,5715efbe
What command shows the default tag as 'latest' when building a Docker image?,machine-learning-zoomcamp,5715efbe
What issue is indicated by the error 'The system cannot find the file specified'?,machine-learning-zoomcamp,5715efbe
How can I ensure that Docker is not stopped by a third-party program?,machine-learning-zoomcamp,5715efbe
What does the error about the docker daemon not running usually indicate?,machine-learning-zoomcamp,5715efbe
What common issue arises when running docker build for the dino-dragon model?,machine-learning-zoomcamp,e32a2dc8
Why might the pip version error occur during this week's coursework?,machine-learning-zoomcamp,e32a2dc8
What Python wheel version should we use to avoid the pip version error?,machine-learning-zoomcamp,e32a2dc8
How can copying the link incorrectly lead to a pip version error?,machine-learning-zoomcamp,e32a2dc8
Where can we find the correct raw format link for the required wheel?,machine-learning-zoomcamp,e32a2dc8
What should be done after installing awscli in relation to AWS configure?,machine-learning-zoomcamp,7070080e
What options are required during the AWS configure process following awscli installation?,machine-learning-zoomcamp,7070080e
Is it acceptable to leave Default output format as None during AWS configure?,machine-learning-zoomcamp,7070080e
Can one leave the AWS configure default settings unchanged except for the keys?,machine-learning-zoomcamp,7070080e
Who contributed the solution regarding AWS configure settings?,machine-learning-zoomcamp,7070080e
What causes a 'float32 is not JSON serializable' error when testing with Docker?,machine-learning-zoomcamp,4e27083c
How can the 'float32 is not JSON serializable' error be resolved when using a Lambda function?,machine-learning-zoomcamp,4e27083c
Why does the dino vs dragon model return numpy float32 values?,machine-learning-zoomcamp,4e27083c
What changes can be made to the predict() function to prevent marshalling errors?,machine-learning-zoomcamp,4e27083c
Where can I find more information on solving issues with deep learning models in Lambda?,machine-learning-zoomcamp,4e27083c
What could be causing the ValueError related to tensor data types in section 9 while using interpreter.set_tensor?,machine-learning-zoomcamp,2e840c7d
How can I resolve the issue of mismatched data types in line interpreter.set_tensor for deep learning?,machine-learning-zoomcamp,2e840c7d
What solution was found for the ValueError in the Serverless Deep Learning course regarding data types?,machine-learning-zoomcamp,2e840c7d
Which version of TensorFlow might be related to the tensor error discussed in section 9?,machine-learning-zoomcamp,2e840c7d
Who provided the solution for the tensor type error in the Serverless Deep Learning FAQ?,machine-learning-zoomcamp,2e840c7d
What command lines can be used in PowerShell to determine a file's size?,machine-learning-zoomcamp,3861b069
How can I find the size of a file in MB using PowerShell terminal?,machine-learning-zoomcamp,3861b069
Which PowerShell commands are required to get the file size of a given path?,machine-learning-zoomcamp,3861b069
Can you guide me on how to check a file size using PowerShell command line?,machine-learning-zoomcamp,3861b069
What are the PowerShell command steps to display a file's size in MB?,machine-learning-zoomcamp,3861b069
How are Lambda container images created and what resources can I consult for a detailed understanding?,machine-learning-zoomcamp,6da8b8a4
What are the initialization steps for Lambda functions using container images?,machine-learning-zoomcamp,6da8b8a4
Where can I find detailed documentation on working with Lambda container images?,machine-learning-zoomcamp,6da8b8a4
Who provided the additional resources for understanding Lambda functions and container images?,machine-learning-zoomcamp,6da8b8a4
What resources exist for in-depth learning about Lambda runtimes and initialization?,machine-learning-zoomcamp,6da8b8a4
How can I deploy a Docker image as a REST API using AWS services?,machine-learning-zoomcamp,cd7dbd3d
What is the procedure to expose a containerized application as a REST API on AWS?,machine-learning-zoomcamp,cd7dbd3d
Can AWS Serverless Framework help in deploying to AWS Lambda and creating a REST API?,machine-learning-zoomcamp,cd7dbd3d
How does one go about using AWS ECR together with Lambda and APIGateway?,machine-learning-zoomcamp,cd7dbd3d
Is there a detailed guide on deploying Flask apps to AWS Lambda using a serverless approach?,machine-learning-zoomcamp,cd7dbd3d
What is the solution for the Docker image build error on M1 Mac when following section 9.5?,machine-learning-zoomcamp,4f05382c
Why does the pip install command fail with an error on M1 Mac during Docker build?,machine-learning-zoomcamp,4f05382c
What alternative command can be used to build the Docker image successfully on M1 Mac?,machine-learning-zoomcamp,4f05382c
"If I face architecture issues on M1 Mac, what should I know about running Docker builds?",machine-learning-zoomcamp,4f05382c
How can I run the Docker image after building it successfully on an M1 Mac?,machine-learning-zoomcamp,4f05382c
What error might occur when testing an API gateway locally in serverless deep learning section 9.7?,machine-learning-zoomcamp,288eaee7
How can I resolve the 'Missing Authentication Token' error when invoking the API Gateway?,machine-learning-zoomcamp,288eaee7
What is required to test the API Gateway in section 9.7 of our serverless deep learning course?,machine-learning-zoomcamp,288eaee7
"When testing a local API gateway, what is a common error message you might see?",machine-learning-zoomcamp,288eaee7
What should be included in the API URL when testing the Lambda function deployment in section 9.7?,machine-learning-zoomcamp,288eaee7
What should I do if I encounter an error about a version not found for tflite_runtime when using pip install?,machine-learning-zoomcamp,9d228728
Where can I check the supported OS and Python version combinations for tflite_runtime?,machine-learning-zoomcamp,9d228728
What are the alternative methods to install tflite_runtime if my OS-Python combination is not supported?,machine-learning-zoomcamp,9d228728
How can I execute code if I cannot install tflite_runtime on my current setup?,machine-learning-zoomcamp,9d228728
Is there a way to use cloud services to run serverless deep learning tasks when facing installation issues?,machine-learning-zoomcamp,9d228728
What should I do if I encounter a read-only file system error when running Docker?,machine-learning-zoomcamp,c91d7689
How can I resolve an error when mkdir fails in Docker due to a read-only file system?,machine-learning-zoomcamp,c91d7689
