id,question
156,What muscles are activated during the machine chest press exercise?
156,Can you describe the proper position to start the machine chest press?
156,What type of workout is the machine chest press classified under?
156,How should I position my feet while using the chest press machine?
157,What is the correct starting position for the Single-Leg Squat exercise?
157,Which muscle groups are primarily engaged during the Single-Leg Squat?
157,How should I position my extended leg while doing the Single-Leg Squat?
157,What is the goal of the movement in the Single-Leg Squat exercise?
157,Is any special equipment required to perform a Single-Leg Squat?
158,What is the starting position for performing a Push-Up to Row?
158,Which equipment do I need for the Push-Up to Row exercise?
158,What are the primary muscle groups targeted when doing the Push-Up to Row?
158,Can you explain the movements involved in the Push-Up to Row?
158,Is the Push-Up to Row classified as a push or pull exercise?
159,What is the primary muscle group targeted by the Smith Machine Row?
159,Can you describe the positioning of my feet during the Smith Machine Row?
159,What action should I take with my torso while performing the Smith Machine Row?
159,Which piece of equipment do I need to perform the Smith Machine Row?
159,Is this exercise primarily for strength training or another type of activity?
160,What type of exercise is the Lat Pullover?
160,Which equipment do I need to perform the Lat Pullover?
160,What muscle groups does the Lat Pullover target?
160,Can you describe how to execute the Lat Pullover?
160,Which body part is primarily worked during the Lat Pullover?
161,What equipment do I need to perform the Smith Machine Shoulder Press?
161,Which muscle groups are primarily worked during the Smith Machine Shoulder Press?
161,What is the correct starting position for the Smith Machine Shoulder Press?
161,How should I execute the lift to ensure my arms are fully extended?
161,Is the Smith Machine Shoulder Press classified as a strength exercise?
162,What is the primary muscle group targeted during the Cable Woodchopper exercise?
162,Can you explain the setup for the Cable Woodchopper using the cable machine?
162,Which body part does the Cable Woodchopper primarily engage?
162,What type of movement does the Cable Woodchopper involve?
162,How do I properly execute the chopping motion in the Cable Woodchopper?
163,What is the primary muscle group targeted by the Machine Back Extension?
163,Which body part does the Machine Back Extension primarily focus on?
163,What is the starting position for the Machine Back Extension exercise?
163,How should I position my feet during the Machine Back Extension?
163,What movement do I perform to complete the Machine Back Extension?
164,What muscles do I engage when performing the Prone Leg Curl?
164,How should I position my body on the leg curl machine?
164,What is the proper movement for the Prone Leg Curl exercise?
164,Is the Prone Leg Curl considered a strength exercise?
164,What body part is primarily targeted by the Prone Leg Curl?
165,What muscles are primarily targeted during the Seated Dumbbell Press?
165,What is the starting position for the Seated Dumbbell Press?
165,Is the Seated Dumbbell Press considered a push exercise?
165,What equipment do I need for the Seated Dumbbell Press?
165,How should I position the dumbbells before starting the press?
166,What is the correct starting position for the Weighted Plank exercise?
166,Which muscle groups are primarily targeted by the Weighted Plank?
166,How should I position the weight plate during the exercise?
166,What is the main goal of holding the Weighted Plank position?
166,Is the Weighted Plank considered a strength training exercise?
167,What type of exercise is the Step Mill considered?
167,Which body parts are primarily targeted when using the Step Mill?
167,Can you describe how to perform the Step Mill exercise correctly?
167,What muscle groups does the Step Mill activate during the workout?
167,Is the Step Mill a suitable exercise for improving cardiovascular fitness?
168,What is the primary muscle group worked during the Standing Resistance Band Row?
168,How should I position my elbows while performing this exercise?
168,What type of equipment do I need for the Standing Resistance Band Row?
168,Can you explain how to properly set up the resistance band for this exercise?
168,Is this exercise primarily for the upper body or lower body?
169,What equipment do I need for the Dumbbell Lunge exercise?
169,Which muscles are activated when performing Dumbbell Lunges?
169,Can you describe the proper form for doing a Dumbbell Lunge?
169,How do I perform the Dumbbell Lunge starting position?
169,Is the Dumbbell Lunge considered a strength or cardio exercise?
170,What is the primary muscle group targeted by the Reverse Curl exercise?
170,How should I position my feet while performing the Reverse Curl?
170,What grip should I use on the dumbbells during this exercise?
170,Are there any specific instructions for lifting the weights in the Reverse Curl?
170,What equipment do I need to perform the Reverse Curl?
171,What equipment do I need to perform the Banded Pull-Up?
171,Which muscle groups are activated when doing a Banded Pull-Up?
171,Can you describe the correct technique for the Banded Pull-Up?
171,What part of the body does the Banded Pull-Up primarily target?
171,Is the Banded Pull-Up considered a strength exercise?
172,What equipment do I need for the Cable Face Pull exercise?
172,Which muscle groups are activated during the Cable Face Pull?
172,Can you walk me through the steps involved in performing a Cable Face Pull?
172,What is the main focus of the Cable Face Pull in terms of movement type?
172,Which body part does the Cable Face Pull primarily target?
173,What is the proper starting position for the Turkish Get-Up exercise?
173,Which muscle groups are primarily engaged during the Turkish Get-Up?
173,What type of equipment do I need to perform the Turkish Get-Up?
173,Can you describe the movement involved in the Turkish Get-Up?
173,Is the Turkish Get-Up considered a strength exercise or a cardio exercise?
174,What is the primary type of exercise for Weighted Russian Twists?
174,Which piece of equipment is used for performing Weighted Russian Twists?
174,What body parts are primarily targeted by the Weighted Russian Twists exercise?
174,Can you describe the main movement involved in performing Weighted Russian Twists?
174,Which muscle groups are engaged during Weighted Russian Twists?
175,What is the primary body part targeted by the Cable Front Raise exercise?
175,Which muscle group is primarily activated during the Cable Front Raise?
175,What type of exercise is the Cable Front Raise classified as?
175,What equipment is required to perform the Cable Front Raise?
175,Can you describe the starting position for the Cable Front Raise exercise?
176,What is the Reverse Crunch exercise and how is it performed?
176,Which muscle groups are primarily activated during the Reverse Crunch?
176,Do I need any equipment to perform the Reverse Crunch?
176,What is the starting position for the Reverse Crunch?
176,Is the Reverse Crunch considered a strength exercise or a cardio exercise?
177,What equipment do I need to perform the Cable Tricep Kickback?
177,Which muscle group is primarily targeted by this exercise?
177,Can you explain how to set up the Cable Tricep Kickback on a cable machine?
177,What is the correct form for performing a Cable Tricep Kickback?
177,Is this exercise considered a push movement?
178,What is the Copenhagen Plank and how is it performed?
178,What muscle groups are targeted when doing the Copenhagen Plank?
178,Do I need any equipment to do the Copenhagen Plank?
178,What position should my legs be in during the Copenhagen Plank?
178,How long should I aim to hold the Copenhagen Plank?
179,What muscles are targeted during the Smith Machine Incline Press?
179,What is the starting position for performing this exercise?
179,What type of equipment do I need for the Smith Machine Incline Press?
179,How do I properly conduct the movement for this exercise?
179,Is the Smith Machine Incline Press more suitable for upper body strength training?
180,What is the correct form for performing a Cable Lat Pulldown?
180,Which muscle groups are primarily targeted with Cable Lat Pulldowns?
180,What equipment do I need to perform this exercise?
180,How should I grip the bar during the Cable Lat Pulldown?
180,What is the movement pattern for this exercise?
181,What equipment do I need to perform the Cable Side Lunge exercise?
181,Which muscle groups are primarily targeted during the Cable Side Lunge?
181,Can you explain the steps involved in doing a Cable Side Lunge?
181,Is the Cable Side Lunge considered a pushing or pulling exercise?
181,What part of the body does the Cable Side Lunge mainly work?
182,What is the primary muscle group targeted by the Dumbbell Bent-Over Row?
182,Do I need any special equipment for the Dumbbell Bent-Over Row?
182,Can you explain the proper stance for performing the Dumbbell Bent-Over Row?
182,Is the Dumbbell Bent-Over Row considered a push or pull exercise?
182,What body part does the Dumbbell Bent-Over Row primarily strengthen?
183,What is the main purpose of the lateral lunge exercise?
183,Which muscle groups are primarily worked during the lateral lunge?
183,What type of equipment do I need to perform a lateral lunge?
183,Can you explain the proper form for a lateral lunge?
183,What part of the body does the lateral lunge target specifically?
184,What are the primary muscle groups worked during the Seated Machine Row?
184,How should I position my feet while using the rowing machine?
184,Can you describe the movement involved in the Seated Machine Row?
184,Is this exercise primarily for the upper body or lower body?
184,What type of exercise is the Seated Machine Row classified as?
185,What are the primary muscle groups targeted by the Decline Russian Twist exercise?
185,What equipment do I need to perform the Decline Russian Twist?
185,Can you describe the proper body position for the Decline Russian Twist?
185,How do I perform the twisting motion during the Decline Russian Twist?
185,What is the type of activity classification for the Decline Russian Twist?
186,What muscles are primarily targeted by the Deadlift High Pull exercise?
186,What equipment do I need to perform a Deadlift High Pull?
186,Can you describe how to correctly execute a Deadlift High Pull?
186,Which body parts are engaged during the Deadlift High Pull?
186,Is the Deadlift High Pull considered a push or pull type of exercise?
187,What is the main muscle group targeted by the Reverse Grip Lat Pulldown exercise?
187,Which equipment do I need to perform the Reverse Grip Lat Pulldown?
187,Can you explain the correct posture for sitting at the lat pulldown machine during this exercise?
187,What type of movement is involved in the Reverse Grip Lat Pulldown?
187,How should I return the bar after pulling it down to my chest?
188,What equipment do I need for the Cable Lateral Lunge exercise?
188,Which muscle groups are primarily targeted during this exercise?
188,How should I position my body while performing the Cable Lateral Lunge?
188,What movement should I perform after stepping out into the side lunge?
188,Is the Cable Lateral Lunge considered a push or pull exercise?
189,What is the starting position for the Pike Push-Up exercise?
189,Which muscle groups are primarily activated during the Pike Push-Up?
189,How do I properly perform the lowering phase of the Pike Push-Up?
189,Is any equipment necessary for performing the Pike Push-Up?
189,What type of activity is the Pike Push-Up categorized as?
190,What is the primary equipment needed for the One-Arm Dumbbell Snatch exercise?
190,Which muscle groups are primarily activated during the One-Arm Dumbbell Snatch?
190,Can you describe the starting position for the One-Arm Dumbbell Snatch?
190,What type of physical activity does the One-Arm Dumbbell Snatch fall under?
190,What is the main motion involved in the One-Arm Dumbbell Snatch?
191,What equipment do I need to perform the Cable Front Squat?
191,Which body part is primarily targeted during the Cable Front Squat?
191,Can you explain the proper stance for this exercise?
191,What muscle groups are worked when doing the Cable Front Squat?
191,What is the correct way to hold the handle while performing this exercise?
192,What muscle groups does the Tire Flip exercise activate?
192,How should I position my body when preparing to flip the tire?
192,Can the Tire Flip be considered a full body workout?
192,What equipment do I need to perform the Tire Flip exercise?
192,Is the Tire Flip a pushing or pulling movement?
193,What muscles are primarily targeted by the Smith Machine Calf Raise exercise?
193,Can you explain the starting position for performing a Smith Machine Calf Raise?
193,What equipment do I need to perform the Smith Machine Calf Raise?
193,What is the movement involved in the Smith Machine Calf Raise exercise?
193,Is the Smith Machine Calf Raise classified as a strength exercise?
194,What is the correct starting position for the Pistol Squat to Box exercise?
194,Which muscle groups are primarily targeted by this exercise?
194,How do you perform the movement of lowering your hips onto the box?
194,Is any equipment needed to perform the Pistol Squat to Box?
194,What type of fitness does this exercise focus on?
195,What muscle groups does the Standing Chest Fly target?
195,What type of equipment is needed for the Standing Chest Fly exercise?
195,Can you describe the starting position for the Standing Chest Fly?
195,Is the Standing Chest Fly classified as a push or pull exercise?
195,What body part do I primarily engage when performing the Standing Chest Fly?
196,What type of exercise is the Sled Drag considered?
196,Which muscles are primarily activated while doing the Sled Drag?
196,How should I position the sled and myself during this exercise?
196,"Can the Sled Drag be performed on any surface, or does it require a specific type?"
196,Is the Sled Drag more focused on cardio or strength training?
197,What is the primary exercise for strengthening the biceps and forearms?
197,How should I be positioned when performing the Cable Hammer Curl?
197,What type of grip should I use while curling the handle?
197,Which type of machine do I need for the Cable Hammer Curl exercise?
197,What body part does this exercise primarily target?
198,What is the targeted muscle group when performing the Cable Tricep Overhead Extension?
198,What type of exercise is the Cable Tricep Overhead Extension classified as?
198,Can this exercise be performed without a cable machine?
198,What position should I be in while starting the Cable Tricep Overhead Extension?
198,What should I do after extending the handle overhead in this exercise?
199,What equipment do I need to perform the Seated Cable Row exercise?
199,Which muscles are primarily worked during the Seated Cable Row?
199,Can you explain the steps involved in executing the Seated Cable Row correctly?
199,Is the Seated Cable Row considered a strength training exercise?
199,What body part does the Seated Cable Row primarily target?
200,What is the primary muscle group activated during the Lying Dumbbell Tricep Extension?
200,What equipment do I need to perform the Lying Dumbbell Tricep Extension?
200,Could you describe the starting position for the Lying Dumbbell Tricep Extension?
200,Is the Lying Dumbbell Tricep Extension considered a push or pull exercise?
200,How should I position my body while performing the Lying Dumbbell Tricep Extension?
201,What equipment do I need to perform a Weighted Pull-Up?
201,Which muscles are primarily engaged during a Weighted Pull-Up?
201,Can you explain how to properly execute a Weighted Pull-Up?
201,"Is a Weighted Pull-Up suitable for beginners, or should I start with regular pull-ups?"
201,What are the benefits of including Weighted Pull-Ups in my strength training routine?
202,What muscles are primarily worked during the Incline Dumbbell Row?
202,What equipment do I need for performing the Incline Dumbbell Row?
202,Can you describe the starting position for the Incline Dumbbell Row?
202,What is the correct movement technique for the Incline Dumbbell Row?
202,Is this exercise effective for strengthening my upper body?
203,What is the primary muscle group targeted during the Machine Lat Pulldown?
203,Can you describe the correct seating position for performing this exercise?
203,How should I grip the bar when using the Machine Lat Pulldown?
203,What is the correct movement pattern for the Machine Lat Pulldown?
203,Is this exercise suitable for beginners?
204,What is the primary muscle group activated during the One-Arm Cable Row exercise?
204,Do I need any specific equipment to perform the One-Arm Cable Row?
204,Can you explain the proper stance for performing the One-Arm Cable Row?
204,What is the correct way to grip the handle during the One-Arm Cable Row?
204,Is the One-Arm Cable Row an effective exercise for building upper body strength?
205,What equipment do I need for the Face Pull exercise?
205,Which muscle groups are primarily worked during the Face Pull?
205,How do I properly perform the Face Pull exercise?
205,What part of the body does the Face Pull target?
205,Is the Face Pull considered a push or pull exercise?
206,What is the primary exercise for building upper body strength using dumbbells?
206,Which muscle groups are activated during the Dumbbell Bench Press?
206,Can you describe the proper setup for performing the Dumbbell Bench Press?
206,What type of equipment is required for the Dumbbell Bench Press?
206,Is the Dumbbell Bench Press considered a push exercise?
