id,question
80,Can you explain the movement involved in the Cable Chest Press?
81,What specific muscles are activated when performing TRX Rows?
81,Can you describe the proper body position for TRX Rows?
81,What type of exercise is TRX Rows classified as?
81,What is the primary action involved in the TRX Rows exercise?
81,Is there any specific equipment required for performing TRX Rows?
82,What equipment do I need for the Medicine Ball Russian Twists?
82,Which muscle groups are activated during this exercise?
82,How should I position my body while performing the twists?
82,Can you explain the tapping motion with the medicine ball?
82,Is this exercise primarily targeting the core or other areas?
83,What muscles does the Pendlay Row primarily target?
83,Can I perform the Pendlay Row with a different type of equipment?
83,What is the proper form to follow while executing the Pendlay Row?
83,How does the Pendlay Row compare to other rowing exercises?
83,What are the benefits of including Pendlay Rows in my strength training routine?
84,What is the main focus of the Side Plank with Leg Lift exercise?
84,Which muscle groups are primarily targeted when performing this exercise?
84,What position should I be in to start the Side Plank with Leg Lift?
84,Do I need any equipment for the Side Plank with Leg Lift?
84,Can you explain the movement I need to perform during the exercise?
85,What is the primary muscle group targeted by the hip abduction exercise?
85,Can you explain how to properly perform the hip abduction on the machine?
85,Is the hip abduction exercise considered a type of push activity?
85,What body part is primarily engaged during the hip abduction exercise?
85,What type of exercise equipment is needed for performing hip abduction?
86,What muscles does the Dumbbell Front Raise target?
86,What position should my palms be in during the exercise?
86,How high do I need to raise my arms when performing this exercise?
86,What type of exercise is the Dumbbell Front Raise classified as?
86,What equipment do I need to perform the Dumbbell Front Raise?
87,What is the correct grip for performing chin-ups?
87,How do I know when to stop pulling myself up during chin-ups?
87,Which muscle groups are primarily worked by chin-ups?
87,"Do I need any equipment to do chin-ups, or can I use my bodyweight?"
87,Can you describe the proper technique for lowering myself after a chin-up?
88,What equipment do I need for the Box Squat exercise?
88,Which muscle groups are primarily worked during the Box Squat?
88,Can you explain the proper form for performing a Box Squat?
88,Is the Box Squat considered a strength training exercise?
88,What body part does the Box Squat target?
89,What are Battle Rope Waves and how do I perform them?
89,Which muscle groups are engaged when doing Battle Rope Waves?
89,Is Battle Rope Waves more of a cardio or strength exercise?
89,What type of equipment do I need for Battle Rope Waves?
89,What body parts are primarily worked during Battle Rope Waves?
90,What is the correct position for holding the barbell during a Zercher Squat?
90,Which muscle groups are primarily worked during the Zercher Squat?
90,How low should I squat to ensure proper form in a Zercher Squat?
90,What type of equipment do I need to perform a Zercher Squat?
90,Is the Zercher Squat classified as a push or pull exercise?
91,What is the primary muscle group targeted by walking lunges?
91,Can walking lunges be performed without any equipment?
91,What is the correct technique for stepping into a lunge?
91,Which body part is primarily engaged during walking lunges?
91,Is it necessary to do walking lunges as a strength exercise?
92,What is the primary exercise being performed?
92,Which equipment is required for the Kettlebell Snatch?
92,What body parts are primarily engaged during this exercise?
92,Can you describe the movement sequence for performing the Kettlebell Snatch?
92,What type of physical activity does the Kettlebell Snatch fall under?
93,What is the primary exercise being performed in this routine?
93,Which body part does the Single-Leg Glute Bridge primarily target?
93,What type of equipment is necessary to perform this exercise?
93,Can you explain the correct starting position for the Single-Leg Glute Bridge?
93,Which muscle groups are engaged while performing this exercise?
94,What is the correct setup for performing TRX Push-Ups?
94,Which muscle groups are primarily engaged during TRX Push-Ups?
94,How should my body be positioned while doing TRX Push-Ups?
94,Is there any specific equipment required for TRX Push-Ups?
94,What type of exercise are TRX Push-Ups classified as?
95,"What type of exercise is the Machine Leg Curl, and how does it classify in terms of movement?"
95,Which muscle groups are primarily worked during the Machine Leg Curl?
95,Can you describe the steps involved in performing the Machine Leg Curl?
95,What equipment do I need to use for the Machine Leg Curl exercise?
95,In what part of the body does the Machine Leg Curl primarily focus?
96,What muscles does the Incline Bench Press primarily work on?
96,What position should I be in during the Incline Bench Press?
96,What equipment is needed to perform the Incline Bench Press?
96,Is the Incline Bench Press a push or pull exercise?
96,Can you describe how to properly execute the Incline Bench Press?
97,What is the name of the exercise that primarily targets the glutes and hamstrings?
97,What type of equipment do I need to perform the Resistance Band Deadlift?
97,Which body parts are primarily engaged during the Resistance Band Deadlift?
97,Can you describe the proper stance for performing the Resistance Band Deadlift?
97,What are the essential steps to lift the band off the ground during this exercise?
98,What equipment do I need for the Decline Bench Press?
98,Which muscle groups are worked during the Decline Bench Press?
98,Can you provide the steps involved in performing the Decline Bench Press?
98,What part of the body does the Decline Bench Press primarily target?
98,Is the Decline Bench Press considered a push exercise?
99,What equipment do I need for the Dumbbell Step-Up exercise?
99,Which muscle groups are targeted when performing the Dumbbell Step-Up?
99,Can you explain the proper technique for doing a Dumbbell Step-Up?
99,Is the Dumbbell Step-Up considered a push or pull exercise?
99,Which body part does the Dumbbell Step-Up primarily work on?
100,What equipment do I need to perform a Cable Lateral Raise?
100,Which muscle groups are primarily worked during the Cable Lateral Raise?
100,Can you describe the proper form for the Cable Lateral Raise?
100,Is the Cable Lateral Raise classified as a push or pull exercise?
100,What body part is primarily targeted when doing the Cable Lateral Raise?
101,What is the correct technique for performing a Reverse Lunge?
101,Which muscle groups are targeted when doing a Reverse Lunge?
101,Is any equipment needed to perform the Reverse Lunge?
101,What part of the body does the Reverse Lunge primarily work on?
101,Is the Reverse Lunge classified as a strength or cardio exercise?
102,What is the proper starting position for toe touches?
102,Which muscle groups are engaged during toe touches?
102,Do I need any equipment to perform toe touches?
102,How should I position my legs while doing this exercise?
102,What is the primary focus of toe touches in terms of body part?
103,What is the primary muscle group activated during the Machine Leg Extension exercise?
103,Can you explain the correct starting position for performing the Machine Leg Extension?
103,Is the Machine Leg Extension classified as a push or pull exercise?
103,Which piece of equipment do I need to perform the Machine Leg Extension?
103,What type of activity does the Machine Leg Extension fall under?
104,What muscles are primarily worked during the Dumbbell Pullover?
104,What equipment do I need to perform a Dumbbell Pullover?
104,Can you explain the proper starting position for the Dumbbell Pullover?
104,Is the Dumbbell Pullover considered a pulling exercise?
104,Which part of the body does the Dumbbell Pullover target?
105,What is the primary muscle group targeted by the Barbell Shrug exercise?
105,Can you explain the proper stance for performing the Barbell Shrug?
105,What equipment do I need to perform the Barbell Shrug effectively?
105,What is the correct technique for shrugging my shoulders during this exercise?
105,Is the Barbell Shrug considered a strength training exercise?
106,What type of exercise is a T-Bar Row and what does it primarily target?
106,What equipment do I need to perform the T-Bar Row?
106,Could you provide a step-by-step guide on how to execute the T-Bar Row correctly?
106,Which muscle groups are activated when performing the T-Bar Row?
106,What stance should I take while doing the T-Bar Row?
107,What equipment do I need to perform the Bulgarian Deadlift?
107,Which body parts are primarily targeted by the Bulgarian Deadlift?
107,Can you describe the proper stance for the Bulgarian Deadlift?
107,What muscles are activated when performing the Bulgarian Deadlift?
107,Is the Bulgarian Deadlift considered a strength exercise?
108,What muscles does the pistol squat primarily target?
108,Can you describe the main steps involved in performing a pistol squat?
108,Is any equipment needed for the pistol squat exercise?
108,What body part does the pistol squat focus on?
108,Is the pistol squat classified as a strength or cardio exercise?
109,What is the primary target muscle for the Seated Leg Curl exercise?
109,Can you explain how to properly position myself on the leg curl machine?
109,What movement should I perform during the Seated Leg Curl?
109,Is this exercise suitable for strengthening my hamstrings?
109,Does the Seated Leg Curl require any special equipment beyond the machine?
110,What type of activity is the Russian Kettlebell Swing considered?
110,Which equipment do I need for performing the Russian Kettlebell Swing?
110,What body parts does the Russian Kettlebell Swing target?
110,Can you explain how to correctly execute the Russian Kettlebell Swing?
110,What muscle groups are activated during the Russian Kettlebell Swing?
111,What is the primary muscle group targeted by the Incline Dumbbell Curl?
111,What equipment do I need to perform the Incline Dumbbell Curl?
111,Can you describe the steps to properly execute the Incline Dumbbell Curl?
111,Is the Incline Dumbbell Curl mainly for upper or lower body strength?
111,What type of exercise is the Incline Dumbbell Curl classified as?
112,What is the primary body part targeted by decline sit-ups?
112,Can you describe how to perform decline sit-ups correctly?
112,What muscle groups are activated during decline sit-ups?
112,Do I need any equipment besides a decline bench for this exercise?
112,What type of exercise are decline sit-ups classified as?
113,What is the primary exercise involved in side plank dips?
113,Which equipment is required to perform side plank dips?
113,What specific body parts does the side plank dip target?
113,Can you describe the movement involved in performing side plank dips?
113,Which muscle groups are activated during side plank dips?
114,What type of exercise is the Single Arm Kettlebell Swing considered to be?
114,Which equipment do I need to perform the Single Arm Kettlebell Swing?
114,What body part does the Single Arm Kettlebell Swing primarily target?
114,What specific muscle groups are activated during the Single Arm Kettlebell Swing?
114,Can you describe the proper technique for performing the Single Arm Kettlebell Swing?
115,What muscle groups are primarily worked during Jumping Squats?
115,How should I properly execute the motion of Jumping Squats?
115,Do I need any equipment to perform Jumping Squats?
115,Is Jumping Squats more of a cardio or strength exercise?
115,What lower body parts benefit the most from doing Jumping Squats?
116,What is the primary muscle group worked during the Cable Chest Fly exercise?
116,Can you describe the setup needed for the Cable Chest Fly?
116,What motion should I follow while performing the Cable Chest Fly?
116,"Is the Cable Chest Fly considered a strength exercise, and what type of activity is it?"
116,Which body part does the Cable Chest Fly primarily target?
117,What is the correct way to hold the dumbbell during the Dumbbell Tricep Extension?
117,Which muscle group is primarily targeted by the Dumbbell Tricep Extension exercise?
117,Can you describe the movement involved in the Dumbbell Tricep Extension?
117,What type of equipment do I need for the Dumbbell Tricep Extension?
117,Is the Dumbbell Tricep Extension considered a push or pull exercise?
118,What position should I be in while using the leg curl machine?
118,Which muscle groups are primarily activated during the leg curl exercise?
118,How do I properly execute the leg curl movement?
118,What type of equipment do I need to perform the leg curl exercise?
118,Is the leg curl classified as a push or pull exercise?
119,What is the starting position for the One-Arm Push-Up exercise?
119,Which muscle groups are primarily engaged during the One-Arm Push-Up?
119,How do you properly lower your body in the One-Arm Push-Up?
119,What type of exercise is the One-Arm Push-Up categorized as?
119,Do you need any equipment for performing a One-Arm Push-Up?
120,What muscles are primarily worked during the Machine Shoulder Press?
120,Can you describe how to properly perform the Machine Shoulder Press?
120,Is the Machine Shoulder Press suitable for beginners?
120,What type of equipment is needed for the Machine Shoulder Press?
120,Which body part is targeted by the Machine Shoulder Press?
121,What are the proper foot positioning and stance for performing a sumo squat?
121,Which muscle groups are primarily engaged during the sumo squat exercise?
121,Can the sumo squat be performed without any equipment?
121,What is the correct depth to lower my hips when executing a sumo squat?
121,"Is the sumo squat considered a push exercise, and if so, why?"
122,What is the main muscle group targeted by the Resistance Band Squat?
122,How should I position the resistance band for this exercise?
122,What body part does the Resistance Band Squat primarily work on?
122,What type of exercise is the Resistance Band Squat classified as?
122,Can you describe the correct form for performing a Resistance Band Squat?
123,What is the primary equipment needed for the One-Legged Squat exercise?
123,Which muscle groups are targeted when performing a One-Legged Squat?
123,Can you describe the starting position for the One-Legged Squat?
123,What is the correct form for lowering into the squat during the One-Legged Squat?
123,How do you return to the starting position after completing the One-Legged Squat?
124,What equipment do I need to perform the Landmine Row exercise?
124,Which muscle groups are primarily targeted when doing the Landmine Row?
124,Can you describe the basic instructions for performing a Landmine Row?
124,Is the Landmine Row considered a strength exercise or a cardio exercise?
124,What body part does the Landmine Row primarily focus on?
125,What is the main focus of the Superman Exercise?
125,Do I need any equipment to perform the Superman Exercise?
125,What specific body parts are targeted by this exercise?
125,Can you explain how to properly execute the Superman Exercise?
125,Is this exercise primarily for strength or endurance?
126,What position should I be in when performing Dumbbell Flyes?
126,How do I properly lower the weights during the Dumbbell Flyes exercise?
126,Which muscle group is primarily activated by Dumbbell Flyes?
126,Do I need any special equipment for doing Dumbbell Flyes?
126,Is Dumbbell Flyes considered a push exercise?
127,What is the primary muscle group targeted by the Reverse Fly exercise?
127,Can you explain the proper stance for performing the Reverse Fly exercise?
127,Which type of equipment is required to perform the Reverse Fly?
127,What body part does the Reverse Fly primarily work on?
127,What position should the dumbbells be in when raised during the Reverse Fly?
128,What equipment do I need for Cable Kickbacks?
128,Which body parts are targeted by the Cable Kickbacks exercise?
128,Can you describe the starting position for performing Cable Kickbacks?
128,Is there a specific form I should maintain when executing the kickback?
128,What muscle groups are mainly activated during Cable Kickbacks?
129,What is the correct starting position for the Kettlebell Push Press?
129,Which muscle groups are primarily worked during the Kettlebell Push Press?
129,How do I perform the Kettlebell Push Press safely?
129,Do I need to use both arms for the Kettlebell Push Press?
129,Can the Kettlebell Push Press help improve my shoulder strength?
130,What is the main purpose of the Dead Bug exercise?
130,Which body parts are primarily targeted by this exercise?
130,Do I need any equipment to perform the Dead Bug exercise?
130,What position should I start in before lowering my arm and leg?
130,How should I maintain my back during the Dead Bug exercise?
131,What muscles are primarily worked during the Smith Machine Squat?
131,Can you provide a step-by-step guide on how to perform the Smith Machine Squat?
131,What are the key safety tips to keep in mind while using the Smith Machine for squats?
131,"Is the Smith Machine Squat suitable for beginners, and are there any modifications for them?"
131,How does the Smith Machine Squat compare to free weight squats in terms of muscle activation?
132,What is the primary focus of the Reverse Hyperextension exercise?
132,Which equipment is used for performing Reverse Hyperextension?
132,What body part does the Reverse Hyperextension primarily target?
132,Can you describe the correct position to start the Reverse Hyperextension?
132,What muscle groups are activated during the Reverse Hyperextension?
133,What is the primary muscle group targeted by the Landmine Twist exercise?
133,How is the Landmine Twist performed using equipment?
133,Can the Landmine Twist improve core strength and stability?
133,What type of movement does the Landmine Twist involve?
133,Is the Landmine Twist suitable for beginners in strength training?
134,What type of exercise is the Machine Row and what equipment is used?
134,Which body part does the Machine Row primarily target?
134,Can you explain the steps involved in performing the Machine Row correctly?
134,What muscle groups are activated during the Machine Row exercise?
134,Is the Machine Row considered a pull-type activity and what is its impact on upper body strength?
135,What type of exercise is the Seated Calf Raise?
135,Which equipment is needed for the Seated Calf Raise?
135,Which part of the body does the Seated Calf Raise target?
135,Can you describe the steps to perform the Seated Calf Raise?
135,What muscle group does the Seated Calf Raise activate?
136,What is the primary muscle group worked during the Kettlebell Windmill exercise?
136,How should I position the kettlebell when performing the Kettlebell Windmill?
136,What body part does the Kettlebell Windmill primarily target?
136,Is the Kettlebell Windmill classified as a strength exercise or a cardio exercise?
136,Which equipment is needed to perform the Kettlebell Windmill?
137,What muscles are activated during the Incline Barbell Bench Press?
137,What type of exercise is the Incline Barbell Bench Press classified as?
137,How should I position myself on the incline bench for this exercise?
137,What equipment do I need to perform the Incline Barbell Bench Press?
137,What is the proper technique for pressing the barbell during this exercise?
138,What is the Kettlebell Goblet Squat and how do I perform it?
138,Which muscle groups are primarily activated when doing the Kettlebell Goblet Squat?
138,Do I need any specific equipment for the Kettlebell Goblet Squat?
138,Is the Kettlebell Goblet Squat classified as a strength exercise?
138,What body parts are targeted in the Kettlebell Goblet Squat?
139,What equipment do I need for Dumbbell Thrusters?
139,Which body parts are targeted during Dumbbell Thrusters?
139,Can you outline the steps for performing Dumbbell Thrusters?
139,Is this exercise classified as strength training or cardio?
139,What muscles are mainly activated when doing Dumbbell Thrusters?
140,What type of exercise is the Lying Leg Curl?
140,Which muscle group is primarily targeted by the Lying Leg Curl?
140,What position should I be in when performing the Lying Leg Curl?
140,What equipment do I need to perform the Lying Leg Curl?
140,How do I perform the Lying Leg Curl correctly?
141,What is the primary muscle group targeted by the Dumbbell Hammer Curl?
141,Can you describe the starting position for performing the Dumbbell Hammer Curl?
141,What type of grip should I use while doing the Dumbbell Hammer Curl?
141,Is the Dumbbell Hammer Curl considered a strength exercise?
141,Which body part is primarily involved during the Dumbbell Hammer Curl?
142,What equipment do I need to perform the Landmine Squat Press?
142,Which muscle groups are targeted during the Landmine Squat Press?
142,Can you explain the technique for the Landmine Squat Press?
142,Is the Landmine Squat Press suitable for a full-body workout?
142,Which movement type is the Landmine Squat Press classified under?
143,What is the proper stance for performing a Zottman Curl?
143,How should I hold the dumbbells during the exercise?
143,Which muscles are primarily engaged when doing the Zottman Curl?
143,What is the sequence of movements involved in the Zottman Curl?
143,Is a supinated grip used throughout the entire exercise?
144,What equipment do I need to perform the Cable Crunch exercise?
144,Which body part is primarily targeted by the Cable Crunch?
144,How should I position my body when doing the Cable Crunch?
144,What is the main muscle group activated during the Cable Crunch?
144,What action should I focus on while crunching down in the Cable Crunch?
145,What is the Stability Ball Pike exercise primarily targeting in the body?
145,What type of equipment do I need for the Stability Ball Pike?
145,Can you explain how to perform the Stability Ball Pike correctly?
145,Which muscle groups are activated during the Stability Ball Pike?
145,Is the Stability Ball Pike considered a strength or cardio exercise?
146,What specific body part does the Standing Calf Raise target?
146,What type of equipment do I need to perform the Standing Calf Raise?
146,Can you explain the proper instructions for performing the Standing Calf Raise?
146,Is the Standing Calf Raise considered a strength or cardio exercise?
146,What muscle groups are activated during the Standing Calf Raise?
147,What is the correct stance when performing the Cable Kickback?
147,Which muscle group is primarily targeted by the Cable Kickback exercise?
147,How should I position the cable machine for the Cable Kickback?
147,What type of motion is involved in the Cable Kickback?
147,Can you explain the step-by-step process for executing a Cable Kickback?
148,What is the starting position for Spider Push-Ups?
148,Which muscle groups are primarily worked during Spider Push-Ups?
148,How should I position my knees while performing this exercise?
148,Is any equipment needed for Spider Push-Ups?
148,What type of exercise are Spider Push-Ups classified as?
149,What equipment do I need for the Resistance Band Chest Press?
149,Which muscle groups are primarily worked during the Resistance Band Chest Press?
149,Can you provide the steps to perform the Resistance Band Chest Press correctly?
149,What body part is specifically targeted by the Resistance Band Chest Press?
149,Is the Resistance Band Chest Press a pushing or pulling exercise?
150,What equipment do I need to perform the One-Arm Dumbbell Row?
150,Which part of the body does the One-Arm Dumbbell Row primarily target?
150,Can you describe the proper stance for the One-Arm Dumbbell Row?
150,What muscle groups are activated during the One-Arm Dumbbell Row?
150,Is the One-Arm Dumbbell Row considered a strength exercise?
151,What is the proper position for performing the Incline Chest Press?
151,Which muscles are primarily targeted during the Incline Chest Press exercise?
151,What equipment do I need to perform the Incline Chest Press?
151,Can the Incline Chest Press help build my upper body strength?
151,What are the steps to correctly perform the Incline Chest Press with dumbbells?
152,What is the primary muscle group worked during the Machine Preacher Curl exercise?
152,Can you explain the setup for using the preacher curl machine?
152,What type of activity does the Machine Preacher Curl fall under?
152,How should I position my arms when performing this exercise?
152,Is the Machine Preacher Curl primarily a pushing or pulling movement?
153,What muscles are primarily targeted during Hanging Knee Raises?
153,How should I position my body when performing Hanging Knee Raises?
153,Is any equipment required for Hanging Knee Raises or can they be done using body weight?
153,What type of exercise is Hanging Knee Raises classified as?
153,What is the correct motion for performing Hanging Knee Raises?
154,What is the proper setup for performing the Decline Dumbbell Press?
154,Which muscle groups are primarily worked during the Decline Dumbbell Press?
154,Can I use different weights for each dumbbell while doing this exercise?
154,What is the correct motion for pressing the dumbbells in this exercise?
154,Is this exercise suitable for beginners or should I have prior experience?
155,What is the starting position for the Glute Kickback exercise?
155,Which muscle groups are primarily activated during the Glute Kickback?
155,Do I need any equipment to perform the Glute Kickback?
155,How should I feel at the top of the movement in the Glute Kickback?
155,What type of exercise is the Glute Kickback categorized as?
156,What is the machine chest press primarily targeting in the upper body?
