id,question
0,What is the starting position for doing push-ups?
0,Which muscle groups are activated during push-ups?
0,Is any special equipment required for push-ups?
0,Can you explain how to properly lower myself during a push-up?
0,What body part do push-ups primarily target?
1,What is the correct stance for performing squats?
1,Which muscle groups are primarily worked during squats?
1,How should I position my chest while doing squats?
1,Is any equipment needed to perform this exercise?
1,What type of exercise is a squat classified as?
2,What is the primary position for performing a plank?
2,Which muscle groups are primarily engaged during the plank exercise?
2,Do I need any equipment to perform a plank?
2,What is the ideal alignment of my body while holding a plank?
2,How should my elbows be positioned during a plank?
3,What is the main muscle group activated during the Deadlift exercise?
3,Can you describe the proper stance for performing a Deadlift?
3,What type of equipment is required to do the Deadlift?
3,How should I position my hands when grasping the barbell for the Deadlift?
3,What movement is involved in lifting the barbell during a Deadlift?
4,What equipment do I need to perform bicep curls?
4,Which muscle groups are primarily worked during bicep curls?
4,What is the correct starting position for performing bicep curls?
4,How should I position my elbows while doing bicep curls?
4,Is bicep curls considered a strength exercise?
5,What is the primary purpose of the Kettlebell Swing exercise?
5,Which muscle groups are activated during the Kettlebell Swing?
5,What are the key instructions to perform the Kettlebell Swing correctly?
5,What type of activity is the Kettlebell Swing classified as?
5,What equipment do I need to perform the Kettlebell Swing?
6,What equipment do I need to perform the Shoulder Press exercise?
6,Which muscle groups are primarily activated during the Shoulder Press?
6,Can you explain the proper technique for performing the Shoulder Press?
6,What body part does the Shoulder Press target?
6,Is the Shoulder Press considered a push or pull exercise?
7,What muscles are primarily worked during the Lat Pulldown exercise?
7,How do I properly position myself on the lat pulldown machine?
7,What grip should I use while performing the Lat Pulldown?
7,Can you explain the movement I should perform during this exercise?
7,Is the Lat Pulldown considered a pull or push exercise?
8,What is the primary muscle group targeted during the Hamstring Stretch?
8,Do I need any equipment to perform the Hamstring Stretch?
8,How should I position my body while doing the Hamstring Stretch?
8,What body part does the Hamstring Stretch mainly focus on?
8,What type of activity is the Hamstring Stretch classified as?
9,What is the primary purpose of Jumping Jacks in a workout routine?
9,Which muscle groups are primarily activated during Jumping Jacks?
9,Can I perform Jumping Jacks without any equipment?
9,What are the steps to properly execute a Jumping Jack?
9,Is Jumping Jacks suitable as a warm-up exercise?
10,What position should I be in while performing the bench press?
10,Which equipment do I need for the bench press exercise?
10,What muscles are primarily worked during the bench press?
10,Can you explain the movement involved in the bench press?
10,Is the bench press classified as a push or pull exercise?
11,What step should I take when performing lunges?
11,How should my knees be positioned during lunges?
11,Which muscle groups are primarily targeted by lunges?
11,Do I need any equipment to perform lunges?
11,What type of exercise are lunges classified as?
12,What muscles are primarily activated during pull-ups?
12,How should I grip the pull-up bar when performing the exercise?
12,What is the correct movement to complete a pull-up?
12,Is any equipment needed for doing pull-ups?
12,Which body part does this exercise mainly target?
13,What muscles are primarily targeted during Mountain Climbers?
13,What is the starting position for performing Mountain Climbers?
13,Is any equipment required to perform Mountain Climbers?
13,How should I move my legs while doing Mountain Climbers?
13,What type of exercise are Mountain Climbers classified as?
14,What is the proper starting position for Leg Raises?
14,Which muscle groups are primarily engaged during Leg Raises?
14,How should I position my legs while performing this exercise?
14,Is any equipment required to perform Leg Raises?
14,What is the correct movement for lifting the legs in this exercise?
15,What is the main focus of the tricep dips exercise?
15,What equipment do I need to perform tricep dips?
15,Can you describe how to properly execute tricep dips?
15,Which muscle groups does the tricep dips exercise target?
15,Is tricep dips considered a push or pull exercise?
16,What muscles are primarily targeted by the Russian Twists exercise?
16,Can I perform Russian Twists without any equipment?
16,What is the correct starting position for Russian Twists?
16,How do I execute the twisting motion in Russian Twists?
16,Which body part does Russian Twists primarily work on?
17,What primary muscle groups do burpees target during the exercise?
17,Can you walk me through the proper technique for performing a burpee?
17,What type of exercise is a burpee categorized as in terms of fitness activity?
17,Is any equipment necessary to perform burpees effectively?
17,What body parts are engaged while doing a burpee?
18,What muscle groups are engaged when performing Dumbbell Rows?
18,What is the recommended body position for doing Dumbbell Rows?
18,Is it necessary to use both hands when doing Dumbbell Rows?
18,What type of activity are Dumbbell Rows classified as?
18,What specific equipment do I need to perform Dumbbell Rows?
19,What is the proper form for performing Goblet Squats with a kettlebell?
19,Which muscle groups are primarily activated when doing Goblet Squats?
19,Is the Goblet Squat considered a push or pull exercise?
19,What equipment do I need to perform Goblet Squats?
19,How deep should my squat be when doing Goblet Squats?
20,What equipment do I need to perform the Glute Bridge exercise?
20,Which muscle groups are primarily activated during the Glute Bridge?
20,Can you describe the proper starting position for the Glute Bridge?
20,What is the main body position during the Glute Bridge exercise?
20,Is the Glute Bridge a push or pull type activity?
21,What is the proper way to hold the dumbbell for an Overhead Tricep Extension?
21,Which muscle group is primarily targeted during the Overhead Tricep Extension exercise?
21,Can I perform the Overhead Tricep Extension without using dumbbells?
21,What body part does the Overhead Tricep Extension primarily work on?
21,What are the key steps involved in performing the Overhead Tricep Extension correctly?
22,What body position should I start in for the side plank exercise?
22,Which muscles are primarily activated during the side plank?
22,What equipment do I need to perform the side plank?
22,How should my body be aligned when holding a side plank?
22,What type of exercise is a side plank classified as?
23,What equipment do I need to perform Cable Flyes?
23,Which muscle groups will I be targeting while doing Cable Flyes?
23,Can you describe the starting position for Cable Flyes?
23,Is Cable Flyes considered a push or pull exercise?
23,What is the proper form for bringing my hands together in this exercise?
24,What is the primary body part targeted by Step-Ups?
24,Do I need any equipment to perform Step-Ups?
24,Can you explain the steps to correctly perform Step-Ups?
24,Which muscle groups are activated when doing Step-Ups?
24,Is Step-Ups considered a strength exercise?
25,What muscles are primarily targeted by barbell rows?
25,What is the proper stance for performing barbell rows?
25,How should I position my body while doing barbell rows?
25,What type of exercise is a barbell row classified as?
25,What equipment do I need to perform barbell rows?
26,What are the primary muscle groups targeted by the Chest Press exercise?
26,What equipment do I need to perform the Chest Press?
26,Can you describe the proper form for executing the Chest Press?
26,Is the Chest Press considered a push or pull exercise?
26,What part of the body is mainly worked when doing the Chest Press?
27,What is the primary muscle group targeted by Box Jumps?
27,Is any special equipment required for Box Jumps?
27,How do you properly execute a Box Jump?
27,What type of exercise is Box Jumps classified as?
27,Which body part is mainly engaged during Box Jumps?
28,What is the primary muscle group activated during Hanging Leg Raises?
28,What type of equipment do I need to perform Hanging Leg Raises?
28,Can you describe how to properly perform Hanging Leg Raises?
28,Is Hanging Leg Raises focused on strength training or cardio?
28,Which body part does Hanging Leg Raises primarily target?
29,What muscles are primarily targeted during the Farmer's Walk exercise?
29,What equipment do I need to perform the Farmer's Walk effectively?
29,Can you explain the correct form for maintaining posture while doing the Farmer's Walk?
29,Is the Farmer's Walk more of a strength or cardio exercise?
29,How should I position the dumbbells while walking in the Farmer's Walk?
30,What is the proper stance for performing calf raises?
30,Which muscle group is primarily targeted by calf raises?
30,Do I need any equipment to perform calf raises?
30,How should I position my feet during the exercise?
30,What is the main motion involved in calf raises?
31,What is the primary type of exercise for Battle Ropes?
31,Which muscle groups are targeted when performing Battle Ropes?
31,Can Battle Ropes be classified as both a cardio and strength exercise?
31,What body part does Battle Ropes mainly focus on?
31,What is the correct technique for using Battle Ropes effectively?
32,What type of activity is involved in the Medicine Ball Slams exercise?
32,Which equipment is necessary for performing Medicine Ball Slams?
32,What muscle groups are activated when doing Medicine Ball Slams?
32,Can you describe the technique for performing a Medicine Ball Slam?
32,Is Medicine Ball Slams effective for training the entire body?
33,What equipment do I need to perform the Dumbbell Deadlift?
33,Which muscle groups are primarily worked during the Dumbbell Deadlift?
33,Can you explain the proper stance for the Dumbbell Deadlift?
33,What are the key steps to execute the Dumbbell Deadlift correctly?
33,Is the Dumbbell Deadlift beneficial for strengthening the lower body?
34,What type of exercise is the Push Press?
34,Which muscle groups are primarily worked during the Push Press?
34,What equipment is required to perform the Push Press?
34,Can you describe the steps for executing a Push Press?
34,Which body part does the Push Press mainly target?
35,What type of exercise is a treadmill run classified as?
35,Which equipment do I need to perform a treadmill run?
35,What body parts are primarily involved in a treadmill run?
35,What muscle groups are activated during a treadmill run?
35,Can you provide instructions for performing a treadmill run effectively?
36,What equipment do I need for the Incline Dumbbell Press?
36,Which muscle groups are targeted during the Incline Dumbbell Press?
36,Can you explain how to properly perform the Incline Dumbbell Press?
36,Is the Incline Dumbbell Press considered a push exercise?
36,What body part does the Incline Dumbbell Press primarily work?
37,What is the starting position for Renegade Rows?
37,Which muscle groups are primarily worked during Renegade Rows?
37,Do I need any special equipment to perform Renegade Rows?
37,Is Renegade Rows considered a strength exercise?
37,How do I perform the rowing motion correctly in Renegade Rows?
38,What muscle groups are primarily activated during the leg press exercise?
38,Can you describe the correct seating position on the leg press machine?
38,How should I position my feet when using the leg press?
38,What type of exercise is the leg press considered?
38,What is the primary movement involved in the leg press exercise?
39,What equipment do I need to perform the Cable Tricep Pushdown?
39,Which muscle groups does the Cable Tricep Pushdown primarily target?
39,Can you describe the proper stance for the Cable Tricep Pushdown exercise?
39,What is the correct movement pattern for the Cable Tricep Pushdown?
39,Is the Cable Tricep Pushdown suitable for upper body strength training?
40,What is the main focus of the Single-Leg Deadlift exercise?
40,Which equipment do I need to perform the Single-Leg Deadlift?
40,How do I position my legs and arms during the Single-Leg Deadlift?
40,What muscle groups are worked by the Single-Leg Deadlift?
40,Is the Single-Leg Deadlift considered a strength or cardio exercise?
41,What is the primary muscle group targeted during inverted rows?
41,"Do I need any equipment to perform inverted rows, or can I do them with just my body weight?"
41,What is the proper form for executing an inverted row to avoid injury?
41,Can inverted rows help improve my pull-up strength over time?
41,Are there any modifications for beginners who find inverted rows too challenging?
42,What is the primary focus of the Pallof Press exercise?
42,What equipment do I need for the Pallof Press?
42,How should I position myself when performing the Pallof Press?
42,Which muscles are primarily worked during the Pallof Press?
42,What is the specific movement involved in the Pallof Press?
43,What is the primary muscle group targeted by the Kettlebell Deadlift?
43,What type of exercise is the Kettlebell Deadlift classified as?
43,How should I position my feet when performing a Kettlebell Deadlift?
43,What equipment do I need to perform the Kettlebell Deadlift?
43,Can you describe the initial setup for the Kettlebell Deadlift?
44,What muscles are primarily worked during Hanging Knee Tucks?
44,What is the correct position when performing Hanging Knee Tucks?
44,Do I need any equipment to perform Hanging Knee Tucks?
44,How do I execute the movement for Hanging Knee Tucks?
44,What type of activity are Hanging Knee Tucks classified as?
45,What specific form should I maintain while doing Resistance Band Pull Aparts?
45,How do I effectively target my rear deltoids with this exercise?
45,Are there any common mistakes to avoid when performing Pull Aparts?
45,What benefits do Resistance Band Pull Aparts offer for my upper body strength?
45,Can I increase the resistance level to make the exercise more challenging?
46,What is the proper stance for performing Bulgarian Split Squats?
46,Which muscles are significantly targeted during this exercise?
46,Is any equipment required to perform Bulgarian Split Squats effectively?
46,How should I position my back foot while doing this exercise?
46,What range of motion should I aim for when lowering my hips?
47,What type of exercise is the Seated Shoulder Press?
47,Which equipment do I need for the Seated Shoulder Press?
47,What specific muscles does the Seated Shoulder Press target?
47,Can you explain the initial position for the Seated Shoulder Press?
47,What is the correct movement for completing the Seated Shoulder Press?
48,What equipment do I need for incline push-ups?
48,Which muscle groups are targeted by incline push-ups?
48,Can you explain how to properly perform incline push-ups?
48,What body part do incline push-ups primarily work on?
48,Is incline push-ups a type of strength training exercise?
49,What equipment do I need to perform hip thrusts?
49,Which muscles are primarily activated during hip thrusts?
49,What is the correct body position for hip thrusts?
49,How do I execute the hip thrust movement properly?
49,Is hip thrusts a push or pull type of exercise?
50,What is the primary muscle group targeted during the Barbell Curl exercise?
50,Can you describe the grip type used when performing a Barbell Curl?
50,What posture should I maintain while standing to execute the Barbell Curl correctly?
50,Is the Barbell Curl exercise considered a pulling movement or a pushing movement?
50,What equipment do I need to perform the Barbell Curl effectively?
51,What type of exercise is the Cable Row?
51,Which equipment do I need for the Cable Row exercise?
51,What body part does the Cable Row primarily target?
51,Can you explain how to perform the Cable Row properly?
51,Which muscle groups does the Cable Row activate?
52,What is the proper starting position for the Plank Shoulder Taps exercise?
52,Which muscle groups are primarily activated during Plank Shoulder Taps?
52,How do I maintain stability while performing the Plank Shoulder Taps?
52,Is any equipment required to perform Plank Shoulder Taps?
52,What type of exercise is Plank Shoulder Taps classified as?
53,What is the name of the exercise that targets the deltoids using dumbbells?
53,What type of activity is the Dumbbell Lateral Raise categorized as?
53,What specific body part does the Dumbbell Lateral Raise primarily work on?
53,Can you describe the proper stance for performing a Dumbbell Lateral Raise?
53,What instruction should I follow for raising my arms during the exercise?
54,What is the proper technique for performing a Wall Sit exercise?
54,Which muscle groups are primarily activated during a Wall Sit?
54,What body part does the Wall Sit primarily target?
54,How long should I hold the Wall Sit position for effective results?
54,Do I need any equipment to perform the Wall Sit exercise?
55,What is the main body part targeted by the Spider Plank exercise?
55,What muscle groups are activated during the Spider Plank?
55,How do you perform the Spider Plank step by step?
55,Is any equipment necessary for the Spider Plank?
55,What type of exercise is the Spider Plank classified as?
56,What is the correct stance for performing a Sumo Deadlift?
56,Which muscles are primarily worked during the Sumo Deadlift?
56,How should I grip the barbell in relation to my knees?
56,What type of equipment do I need for the Sumo Deadlift?
56,What is the main movement pattern involved in this exercise?
57,What is the primary exercise for targeting the upper body muscle groups?
57,Which muscle groups are primarily engaged during the Single Arm Dumbbell Row?
57,How should I position my body when performing this exercise?
57,What type of equipment do I need for the Single Arm Dumbbell Row?
57,What is the movement pattern involved in this strength exercise?
58,What muscles does the Kettlebell Clean and Press target?
58,Can you explain the correct form for swinging the kettlebell?
58,"Is this exercise suitable for beginners, or should I have prior experience?"
58,How many repetitions should I aim for during a workout session?
58,What are the benefits of including the Kettlebell Clean and Press in my routine?
59,What is the primary type of activity for Jump Rope?
59,Which muscle groups are primarily activated when jumping rope?
59,What equipment do I need for this exercise?
59,Can you explain the proper technique for jumping rope?
59,Is Jump Rope a full body workout?
60,What is the primary muscle group targeted by the Side Lunge exercise?
60,Can the Side Lunge be performed without any equipment?
60,What motion is involved in executing a Side Lunge?
60,Which body part does the Side Lunge primarily strengthen?
60,Is the Side Lunge categorized under strength training or cardio?
61,What is the primary muscle group targeted by the Machine Chest Fly?
61,Can you describe the correct starting position for the Machine Chest Fly?
61,What type of equipment is used for the Machine Chest Fly exercise?
61,Is the Machine Chest Fly considered a push or pull exercise?
61,What body part does the Machine Chest Fly work on?
62,What is the primary muscle group targeted by the Hack Squat exercise?
62,Which type of equipment is required to perform the Hack Squat?
62,Can you describe the main steps involved in performing a Hack Squat?
62,Is the Hack Squat considered a strength training exercise?
62,Which body part does the Hack Squat primarily focus on during the workout?
63,What is the primary muscle group targeted by decline push-ups?
63,How should I position my body to perform a decline push-up correctly?
63,Is any equipment required to perform decline push-ups?
63,What type of exercise are decline push-ups classified as?
63,What specific body part do decline push-ups mainly strengthen?
64,What type of equipment do I need for the Band Face Pull exercise?
64,Which muscle groups does the Band Face Pull primarily target?
64,How should I position the resistance band before starting the Band Face Pull?
64,What is the correct movement technique for the Band Face Pull?
64,Is the Band Face Pull focused on pushing or pulling actions?
65,What is the primary muscle group worked during the Ab Wheel Rollout?
65,Do I need any special equipment for the Ab Wheel Rollout?
65,Can you describe the starting position for performing the Ab Wheel Rollout?
65,Is the Ab Wheel Rollout primarily a strength or cardio exercise?
65,What should I focus on while rolling the ab wheel forward?
66,What is the primary muscle group activated during Side Leg Raises?
66,Can Side Leg Raises be performed without any equipment?
66,What is the correct starting position for executing Side Leg Raises?
66,How should I position my legs while doing Side Leg Raises?
66,Is the Side Leg Raise considered a mobility exercise?
67,What is the primary muscle group activated during the Romanian Deadlift?
67,Can I perform the Romanian Deadlift with a different type of equipment than a barbell?
67,What is the proper form for executing the Romanian Deadlift?
67,Is the Romanian Deadlift considered a pulling or a pushing exercise?
67,Which body part is primarily targeted when doing a Romanian Deadlift?
68,What muscles are primarily targeted by the Arnold Press?
68,Can you describe the correct hand position during the exercise?
68,What type of equipment do I need for the Arnold Press?
68,What is the initial position of the dumbbells before starting the press?
68,Is the Arnold Press considered a pushing exercise?
69,What is the primary body part targeted by the Landmine Press exercise?
69,Can you explain the correct form for performing the Landmine Press?
69,Which muscle groups are activated while doing the Landmine Press?
69,What type of equipment do I need to perform the Landmine Press?
69,Is the Landmine Press considered a pushing exercise?
70,What are Tuck Jumps and what muscles do they target?
70,How do you properly perform a Tuck Jump?
70,What type of equipment is needed for Tuck Jumps?
70,Can Tuck Jumps be classified as both a cardio and strength exercise?
70,Which body part is primarily engaged during Tuck Jumps?
71,What is the starting position for the Windshield Wipers exercise?
71,Which muscle groups are primarily targeted during Windshield Wipers?
71,How should I move my legs while performing the Windshield Wipers?
71,Is any equipment needed for the Windshield Wipers exercise?
71,What type of exercise is Windshield Wipers categorized as?
72,What is the primary muscle group targeted when performing Dumbbell Shrugs?
72,Can you describe the starting position for Dumbbell Shrugs?
72,What type of activity is Dumbbell Shrugs categorized under?
72,How should I perform the shoulder movement during Dumbbell Shrugs?
72,What equipment do I need to do Dumbbell Shrugs?
73,What type of equipment is required for the Sled Push exercise?
73,Which muscle groups are primarily engaged when performing the Sled Push?
73,"Can you describe the proper form for the Sled Push, including any key posture points?"
73,"What type of activity does the Sled Push fall under, cardio or strength?"
73,"Is the Sled Push effective for full body workouts, and if so, how?"
74,What type of exercise is the Cable Bicep Curl considered?
74,Which equipment is required to perform the Cable Bicep Curl?
74,What specific muscle groups are targeted when doing the Cable Bicep Curl?
74,Can you describe how to properly execute the Cable Bicep Curl?
74,What body part does the Cable Bicep Curl primarily focus on?
75,What is the primary muscle group worked during the Dumbbell Kickback exercise?
75,What type of exercise classification does the Dumbbell Kickback fall under?
75,Can you explain the steps involved in performing a Dumbbell Kickback correctly?
75,Which body part is primarily engaged when doing the Dumbbell Kickback?
75,What equipment do I need to perform the Dumbbell Kickback exercise?
76,What is the correct starting position for performing Flutter Kicks?
76,Which muscle groups are primarily targeted by Flutter Kicks?
76,Do I need any equipment to perform Flutter Kicks?
76,How should my legs be positioned during the exercise?
76,What is the main focus of the Flutter Kicks movement?
77,What is the primary purpose of the High Knees exercise?
77,Which muscle groups are activated when performing High Knees?
77,Do I need any equipment to perform High Knees?
77,How should I position my knees during the exercise?
77,Is High Knees considered a cardio activity?
78,What type of exercise are Sledgehammer Slams classified as?
78,Which muscle groups are primarily activated during Sledgehammer Slams?
78,What equipment do I need to perform Sledgehammer Slams?
78,Can you provide me with the instructions for executing Sledgehammer Slams?
78,What body parts are worked when doing Sledgehammer Slams?
79,What is the correct way to perform a Lateral Step-Up exercise?
79,Which muscle groups are primarily targeted during Lateral Step-Ups?
79,"Is any equipment needed for Lateral Step-Ups, or can I do them with just my body weight?"
79,How does the Lateral Step-Up work my lower body specifically?
79,Is this exercise classified under strength training or another type of workout?
80,What is the correct position to start the Cable Chest Press?
80,Which muscles are primarily targeted during the Cable Chest Press?
80,What type of exercise is the Cable Chest Press classified as?
80,What equipment do I need to perform the Cable Chest Press?
